Description;telephone;Description_2;Description_3;clusters
une etoille puisqu il n y en a pas moins  responsable qui vous meprise  par telephone et vous prend de haut   vraiment incroyable;1;['etoill', 'puisqu', 'respons', 'mepris', 'haut'];etoill puisqu respons mepris haut;2
j  ai eu un entretien avec la conseiller et  a chaque fois que je lui est pose une question elle souffler derriere son telephone  franchement c est mal poli;1;['souffl', 'derrier'];souffl derrier;2
avant ma creation d entreprise  donc sans emploi  je recevais mes indemnisations correctement  depuis que j ai cree mon entreprise  donc maintenant j ai un emploi je trouve important de le preciser  je n ai jamais autant galerer pour recevoir mes indemnisations  a par les appeler tous les mois et se battre avec eux pour recevoir l argent qui nous est du je trouve cela inadmissible et je perd de plus en plus patience chaque mois leur excuse   manque de personnel    alors d accord sauf qu on a tous des choses a payer tous les mois et recevoir ses indemnisations le 20 du mois alors qu on envoi les documents a temps  ils ne les prennent pas en compte la plupart du temps et ne nous previennent meme pas  tout ca pour dire que c est la seule agence qui fait ce genre de choses car pour avoir 2 personnes autour de moi dans la meme situation professionnelle et etant sur les agences de bourg et oyonnax elles ont toujours ete payees a temps  quand on essaye de les appeler on nous dit temps d attente 1min et personne ne repond  mais est ce etonnant   pas vraiment  cela reflete bien l agence ;1;['recev', 'indemnis', 'galer', 'indemnis', 'battr', 'argent', 'inadmissibl', 'perd', 'patienc', 'personnel', 'accord', 'pai', 'indemnis', 'docu', 'prennent', 'compt', 'plupart', 'previennent', 'agenc', 'person', 'autour', 'agenc', 'bourg', 'oyonnax', 'paye', '1min', 'person', 'eton', 'reflet', 'agenc'];recev indemnis galer indemnis battr argent inadmissibl perd patienc personnel accord pai indemnis docu prennent compt plupart previennent agenc person autour agenc bourg oyonnax paye 1min person eton reflet agenc;1
ne respectent pas les gens  au telephone on entendait les rires des collegues  c est le centre aere ;1;['respectent', 'entend', 'rir', 'collegu', 'aer'];respectent entend rir collegu aer;-1
impossible de les joindre par mail ou par telephone  j en ai plus qu assez de devoir constamment les contacter pendant 3 semaines ou plus pour un probleme qui peut se resoudre en 5 minutes  merci de bien vouloir nous notifier quand un e conseiller e part en vacances  puisque ceux ci ne prendront pas la peine de vous repondre   ps   j attends toujours au telephone apres 3 semaines   ;1;['const', 'contact', 'resoudr', 'vouloir', 'notifi', 'e', 'e', 'vacanc', 'prendront', 'p', 'attend'];const contact resoudr vouloir notifi e e vacanc prendront p attend;1
ne pouvant mettre 0  inscription le 19mai  debut d indemnisation au 14 juin  toujours rien recu le 12 juillet  de nombreux mails envoyes a ma  referente  indemnisation depuis le 04 juillet toujours sans reponse  c est drole de lire qu une reponse sera donnee dans les 48h ouvrees  quand j appelle le 3949 que j ai a attendre 14 minutes ou 7 minutes au final tous les conseillers sont en ligne  je laisse un message vocal  avec une reponse sous 24h de ma conseillere referente    toujours rien     pendant ce temps la tous mes paiements refuses  aucune indication sur qui  quoi  comment  et c est ca le pire   la seule chose positive  une dame excessivement gentille lors de ma venue a l agence mais helas cette adorable femme ne peut remonter le niveau deplorable et le  j m en foutisme  dont font preuve d autres conseillers eres  alors que les allocataires se retrouvent dans des me des inimaginables    pathetique et tres enervant    ;1;['19mai', 'indemnis', '14', 'juin', 'juillet', 'indemnis', '04', 'juillet', 'repons', 'drol', 'repons', 'donne', '48h', 'ouvre', '3949', '14', 'vocal', 'repons', '24h', 'pai', 'excess', 'gentill', 'venu', 'agenc', 'hel', 'ador', 'femm', 'remont', 'deplor', 'foutism', 'ere', 'allocatair', 'retrouvent', 'inimagin', 'pathet', 'enerv'];19mai indemnis 14 juin juillet indemnis 04 juillet repons drol repons donne 48h ouvre 3949 14 vocal repons 24h pai excess gentill venu agenc hel ador femm remont deplor foutism ere allocatair retrouvent inimagin pathet enerv;1
mon dossier inscription avance malgre deux impairs  non imputable a pole emploi  j ai recu deux appels telephoniques pour m expliquer certaines choses  et ainsi  ne me laissant pas dans le doute et l attente  le personnels est tres reactifs  courtois et agreables humainement parlant ;1;['dossi', 'impair', 'imput', 'personnel', 'reactif', 'courtois', 'parl'];dossi impair imput personnel reactif courtois parl;-1
accueil telephonique excecrable  la personne qui m a repondu m a tout simplement crie dessus alors que je posais de simples questions et ne m a apporte aucune explication concrete  de plus il m a fallu plusieurs mois pour obtenir une reponse par mail de ma conseillere  service public lamentable qui se fiche du monde ;1;['excecr', 'person', 'cri', 'dessus', 'pos', 'simpl', 'apport', 'concret', 'fallu', 'repons', 'servic'];excecr person cri dessus pos simpl apport concret fallu repons servic;2
un certain  laurent  de memoire   n a pas attendu de savoir si j avais finis de poser mes questions et m a dit merci au revoir et m a raccrocher au nez  comportement irrespectueux sans oublier son  mais vous etes tetu    non je veux juste etre sur de ne pas me faire radier pour une raison quelconque et etre a jour dans mon dossier ;1;['laurent', 'memoir', 'attendu', 'pos', 'revoir', 'raccroch', 'nez', 'irrespectu', 'oubli', 'tetu', 'radi', 'quelconqu', 'dossi'];laurent memoir attendu pos revoir raccroch nez irrespectu oubli tetu radi quelconqu dossi;2
honteux  quand on appelle on attend 20 min pour avoir quelqu un pour qu au final on nous dise de rappeler ulterieurement car tous les conseiller sont en ligne  quand on arrive a avoir qlq au bout du fil la personne aide en rien a part dire   envoyez un mail a un tel   quand on se deplace en agence parceque on a pas eu de l aide au telephone  les personnes de l agence nous prennent de haut  ecoute pas nos explications  et nous envoie balader en disant d envoyer des mails a pierre paul jack au final on a toujours pas eu de reponse a nos questions  merci pole emploi  ;1;['attend', 'min', 'ulterieur', 'qlq', 'fil', 'person', 'tel', 'agenc', 'parcequ', 'person', 'agenc', 'prennent', 'haut', 'balad', 'pierr', 'paul', 'jack', 'repons'];attend min ulterieur qlq fil person tel agenc parcequ person agenc prennent haut balad pierr paul jack repons;-1
accueil telephonique horrible   j appelle pour leurs  poser une question par rapport a mon allocation car j ai eu plusieurs soucis avec eux et on me parle sur un ton agressif  ;1;['horribl', 'pos', 'alloc', 'souc', 'agress'];horribl pos alloc souc agress;2
j ai jamais eu un accueil telephonique aussi horrible  je travaille je leurs pose une question car je ne comprend pas et la sa part en vrille et sa me raccroche au nez   ;1;['horribl', 'vrill', 'raccroch', 'nez'];horribl vrill raccroch nez;-1
une certaine sylvie ma conseillere qui me dit suite a ma demande d obtenir un entretien   je ne vais pas vous faire venir chez moi   dans le plus grand des calme au lieu d expliquer simplement que ce n est pas possible a cause de la situation actuelle    le rdv sera maintenant par telephone et pas autrement    discours de toute puissance qui finira par un    vous allez voir   en fin de conversation   digne d une salarie d un service publique cense prendre en charge l accompagnement des personnes   je ne pense pas ;1;['sylv', 'calm', 'actuel', 'rdv', 'autr', 'discour', 'puissanc', 'dign', 'servic', 'person'];sylv calm actuel rdv autr discour puissanc dign servic person;-1
juste une honte   j ai eu affaire a marie helene kone  par rdv telephonique qui a dure 30 minutes et cela un an apres mon inscription chez pole emploi  une blague   durant cette annee  je n ai eu aucun appel  aucun rdv  aucune nouvelle  rien  j ai ete oubliee ;1;['affair', 'helen', 'kon', 'rdv', 'blagu', 'rdv', 'oublie'];affair helen kon rdv blagu rdv oublie;1
une plainte dans un contexte plus approprie suivra sans doute  pour le moment il suffit de savoir qu ils n ont aucune competence en communication  apres 4 mois mon dossier est toujours incomplet et je dois faire un travail telephonique constant pour obtenir des informations et debloquer le processus  lors d une reunion physique  le conseiller est devenu  physique   j ai subi une agression  une tres mauvaise scene en plein bureau public  pole emploi n est pas starbucks  si vous ne l aimez pas vous ne pouvez pas le changer  mais preparez vous a ce qui vous attend ;1;['plaint', 'context', 'appropr', 'suivr', 'suff', 'competent', 'dossi', 'incomplet', 'const', 'debloqu', 'processus', 'sub', 'agress', 'scen', 'bureau', 'starbuck', 'prepar', 'attend'];plaint context appropr suivr suff competent dossi incomplet const debloqu processus sub agress scen bureau starbuck prepar attend;1
au telephone avec la conseillere sophie d une ecoute et d un professionnalisme incroyable il en faudrait plus des personnes comme elle  ;1;['soph', 'professionnal', 'person'];soph professionnal person;-1
0 10 j appelle depuis 9h on m a repondu et raccroche dessus 2 fois alors que le temps d attente est de minimum 15 min a chaque fois  j ai demande a ce qu on me rapl dans les 2h ca n a pas ete fait  nous sommes en crise sanitaire et ils preferent que les gens ce deplace en agence directement c est incroyable;1;['9h', 'raccroch', 'dessus', 'min', 'rapl', '2h', 'cris', 'sanitair', 'preferent', 'agenc'];9h raccroch dessus min rapl 2h cris sanitair preferent agenc;1
j aimerais joindre la conseillere mais impossible de d avoir un contact direct    pour avoir des  renseignements par telephone    ne pouvant pas me deplacer ;1;['contact'];contact;0
je ne comprends pas comment des gens aussi incompetents peuvent avoir un poste si important j ai eu un entretien telephonique pour trouver une formation et la conseillere elle me dit quoi     il faut avoir de l experience pour faire une formation     ;1;['incompetent', 'format', 'format'];incompetent format format;-1
impossible de vous joindre;1;[];;2
je ne recois plus mes allocations sans aucunes raisons  on me demande d appeler le 3949  on ne me repond pas  on ne me rappelle pas et quand on me rappelle on me raccroche au nez ;1;['alloc', 'raison', '3949', 'raccroch', 'nez'];alloc raison 3949 raccroch nez;2
il ne repond jamais au telephone    ;1;[];;2
non seulement les conseillers sont tres incompetents  mais pas sympa du tout  par ex  il vous faut un document  il faut venir le chercher meme si vous habitez loin    c est selon le desiderata de la direction    heureusement qu il y a encore des conseillees sympa au 3949 qui peuvent vous l envoyer par mail  ;1;['incompetent', 'ex', 'docu', 'habit', 'selon', 'desiderat', 'conseille', '3949'];incompetent ex docu habit selon desiderat conseille 3949;1
bien et accueil sympathique  je vais pas faire toute une explication sur ce que c est pole emploi car je pense que tout le monde connais et sait a quoi sa sert  par contre bon juste etre un peu plus polis au telephone ne serais pas trop demande ;1;['sympath'];sympath;2
bien et accueil sympathique  je vais pas faire toute une explication sur ce que c est pole emploi car je pense que tout le monde connais et sait a quoi sa sert  par contre bon juste etre un peu plus polis au telephone ne serais pas trop demande ;1;['sympath'];sympath;2
service deplorable  mon dossier bloque pour un changement de region  ne reponds pas a leurs collegues d une autre region fait tout pour mettre des batons dans les roues   continuer de faire les fantomes cela vous va si bien ;1;['servic', 'deplor', 'dossi', 'region', 'collegu', 'region', 'baton', 'rou', 'fantom'];servic deplor dossi region collegu region baton rou fantom;-1
j ai eu du mal sur leur site donc j ai telephone leur service telephonique pour prendre un rendez vous  un monsieur m a repondu sans dire bonjour ni au revoir  juste une seule phrase  va sur poleemploi fr  vous etes paye pour aider les gens mais limite cela vous derange qu on vous appelle  rentrez chez vous et dormez dans ce cas la  bande de malpolis;1;['servic', 'revoir', 'phras', 'poleemploi', 'pay', 'derang', 'dorm', 'band', 'malpol'];servic revoir phras poleemploi pay derang dorm band malpol;2
j ai eu un rv telephonique et la personne au telephone etait sympathique et serviable  elle a su repondre a toutes mes questions et bien me conseiller  j espere que ca continuera ainsi     ;1;['rv', 'person', 'sympath', 'serviabl'];rv person sympath serviabl;2
deplorable   non seulement ils etait injoignables par telephone comme maintenant                                  momentanement   c est les autres agences qui prennent en charge les appels  rien a dire au moins ils reponds mais peuvent rien faire puisque c est pas mon agence   donc ca ne sert a rien   par e mail personne reponds depuis plus d un mois   demande d indemnisation pour conge non paye suite fermeture annuelle de l entreprise  pas traite depuis 3 mois ;1;['deplor', 'injoign', 'momentan', 'agenc', 'prennent', 'agenc', 'e', 'person', 'indemnis', 'cong', 'pay', 'fermetur', 'annuel'];deplor injoign momentan agenc prennent agenc e person indemnis cong pay fermetur annuel;-1
beaucoup de mal a les joindre   ;1;[];;2
tres mauvais accueil telephonique  prends les gens de haut alors que c est le site qui n est pas a jour  insolence et impolitesse bien au rendrez vous  tres fort pour rabaisser et humilier les gens ;1;['mauv', 'prend', 'haut', 'insolent', 'impolitess', 'rendr', 'rabaiss', 'humili'];mauv prend haut insolent impolitess rendr rabaiss humili;2
il n est pas possible d appeler ou d avoir un courrier direct  le courrier que j ai envoye et signale etre arrive a ce bureau n a jamais ete livre au bureau principal  ces modalites m ont fait perdre beaucoup d argent et beaucoup de temps  a revoir le systeme  pas efficace ;1;['courri', 'courri', 'bureau', 'livr', 'bureau', 'modalit', 'argent', 'revoir', 'system'];courri courri bureau livr bureau modalit argent revoir system;1
de plus en plus  impoli  meprisant et hautain   service pire que deplorable a ce stade  heureusement que les entretiens ce font par telephone  n appelez pas  surtout en fin de journee au risque de tomber sur une harpie aigris qui ne vous ecoutera pas et vous enverra chiee  entretiens telephoniques  les responsables je vois invite a ecouter l audio du jeudi 10 octobre 2022 sur mes allocations que je cotise;1;['impol', 'mepris', 'hautain', 'servic', 'deplor', 'stad', 'tomb', 'harp', 'aigr', 'enverr', 'chie', 'respons', 'vois', 'invit', 'audio', 'jeud', 'alloc'];impol mepris hautain servic deplor stad tomb harp aigr enverr chie respons vois invit audio jeud alloc;1
aucun accompagnement  mme yeti pas d experience  trop jeune  repond pas aux mail pas de telephone  idem pour service indemnite zero pointe  c est plutot pole pas emploi;1;['mme', 'yeti', 'jeun', 'idem', 'servic', 'indemnit', 'point'];mme yeti jeun idem servic indemnit point;1
ils ont aucune connaissance de leur metier  j ai deja eu 3 rdv loupe avec eux car ils ne mon pas appeler sur le bon numero    du coup  j ai eu un avertissement de radiation  oblige d envoyer des mails a leur agence  ce sont des specimens tres interessant  de plus  quand j etais a l agence pour la premiere fois  quelqu un ce moquais d un beneficiaire ouvertement  bravo l hypocrisie   ;1;['rdv', 'loup', 'avert', 'agenc', 'specimen', 'agenc', 'moqu', 'beneficiair', 'ouvert', 'hypocris'];rdv loup avert agenc specimen agenc moqu beneficiair ouvert hypocris;-1
tres mauvaise agence et je ne decolere pas depuis plusieurs annees  j ai realise un dossier de demande de formation qui a ete egare par cette agence  j ai  aujourd hui  encore mal aux oreilles  lorsque par telephone  qu une personne responsable de l agence d evreux m annonce que le pole emploi de gisors a egare mon dossier  un deploiement d energie  de moyens pour s en sortir qui finalement n abouti pas du tout  aujourd hui  on continu de me repondre avec denie  voire des phrases formatees  je suis dans l impasse depuis   de 2 ans en raison d un total manque de respect via le demandeur d emploi  je vous invite pas non plus  a suivre l une de leur formation  des formations particulierement ennuyeuses avec pour certains formateur un manque de pedagogie evidente et a souligner   a noter   que les avis favorables de cette page sont essentiellement ecrites par des  local guide  a se demander si  certains ne sont pas  mandates  pour ecrire ce type de texte     une agence pour l emploi d une tres negligence et d une grande incompetence  une enquete mediapart me semble a l avenir indispensable    ;1;['agenc', 'decoler', 'dossi', 'format', 'egar', 'agenc', 'oreil', 'person', 'respons', 'agenc', 'evreux', 'gisor', 'egar', 'dossi', 'deploi', 'energ', 'about', 'den', 'phras', 'formate', 'impass', 'respect', 'invit', 'format', 'format', 'ennui', 'pedagog', 'soulign', 'favor', 'essentiel', 'guid', 'mandat', 'ecrir', 'agenc', 'negligent', 'incompetent', 'enquet', 'mediapart', 'aven', 'indispens'];agenc decoler dossi format egar agenc oreil person respons agenc evreux gisor egar dossi deploi energ about den phras formate impass respect invit format format ennui pedagog soulign favor essentiel guid mandat ecrir agenc negligent incompetent enquet mediapart aven indispens;1
aucune communication aucun moyen d appeler c est vachement utile surtout avec les convocation inutile completement hors sujets de vos recherches serieusement a eviter surtout avec les soit disant aide financier qui n existe pas ;1;['vach', 'util', 'convoc', 'hor', 'financi'];vach util convoc hor financi;-1
deja qu au niveau competences on est pas franchement sur des prix nobels  mais c est clairement pas avec les horaires de travail qu ils font que ca va les etouffer             appel a 15h32   le service est ouvert jusqu a 15h30 ;1;['prix', 'nobel', 'horair', 'etouff', '15h32', 'servic', 'ouvert', '15h30'];prix nobel horair etouff 15h32 servic ouvert 15h30;1
je recommande le pole emploi de guingamp   en effet j ai demande plusieurs fois a avoir un rdv avec mes conseillers et ceux ci ont accepte que ce soit par mail   telephone   un rdv physique a l agence   ma conseillere s est meme deplacee jusqu a l agence de paimpol pour avoir un entretien sur mes demarches   j attends un financement pour une formation et j ai ete bien conseille pour savoir quels organismes contacter   felicitation pour votre patience et votre serieux a bientot   kenavo;1;['recommand', 'guingamp', 'rdv', 'rdv', 'agenc', 'deplace', 'agenc', 'paimpol', 'demarch', 'attend', 'financ', 'format', 'contact', 'felicit', 'patienc', 'bientot', 'kenavo'];recommand guingamp rdv rdv agenc deplace agenc paimpol demarch attend financ format contact felicit patienc bientot kenavo;1
et encore une etoile je suis gentille   entre les pertes de documents  oblige de se deplacer plusieurs fois  ainsi que passer plusieurs coups de fils pour que ces derniers soient pris en compte  ma conseillere  alors la le top du top  je rigole bien sur  on se sait jamais parler  on ose me laisser un message vocal en me parlant comme si j etais un chien  on se permet de juger ma vie parce que je ne reponds pas au coup de fil  desole si je boss hein  le professionnalisme vous connaissez   et l amabilite   parce que la bas  le neant total  ;1;['gentill', 'docu', 'coup', 'fil', 'derni', 'compt', 'top', 'top', 'rigol', 'ose', 'vocal', 'parl', 'chien', 'jug', 'fil', 'desol', 'boss', 'hein', 'professionnal', 'amabilit', 'ne'];gentill docu coup fil derni compt top top rigol ose vocal parl chien jug fil desol boss hein professionnal amabilit ne;2
j aurais mis 0 etoile  j appelle ce matin des l ouverture pour savoir quel justificatif il demande exactement pour une reinscription apres un conge maternite  on me transfere le service indemnisation qui n a rien compris a ce que je demandais   alors que c est tres simple  surtout en ce qui concerne le cmg  je precise que je n ai jamais pris de conge parentale car la conseillere a cru a cela car elle ne sait pas ce qu est le cmg  alors soit elle doit changer de metier soit se former  j ai appele pour une simple question j attendais une simple reponse courtoise mais  cela aussi doit s apprendre en tant qu individu  ya du travail  au moins a versailles ils etaient polis et intelligents;1;['ouvertur', 'justif', 'exact', 'reinscript', 'cong', 'maternit', 'transfer', 'servic', 'indemnis', 'compr', 'cmg', 'cong', 'parental', 'cru', 'cmg', 'attend', 'repons', 'courtois', 'apprendr', 'individu', 'ya', 'versaill', 'intelligent'];ouvertur justif exact reinscript cong maternit transfer servic indemnis compr cmg cong parental cru cmg attend repons courtois apprendr individu ya versaill intelligent;1
ne repondent jamais au telephone;1;['repondent'];repondent;-1
je n ai que des problemes   3 fois que j envoie des documents  que je les remets en main propre  et qu ils arrivent a les perdre   on me raccroche au nez  seule fois ou j ai reussis a les joindre  parce que je perds patience   mais toujours avec politesse    bientot 2 mois qu ils doivent valider ma demande d aide a la mobilite  impossible de les joindre   tres tres decue  ;1;['docu', 'remet', 'main', 'propr', 'arrivent', 'raccroch', 'nez', 'reuss', 'perd', 'patienc', 'politess', 'bientot'];docu remet main propr arrivent raccroch nez reuss perd patienc politess bientot;2
les conseillers ne repondent pas aux messages  impossible d avoir quelqu un au telephone  ils mettent des mois a traiter les documents  resultat 1 mois de retard dans le traitement de mon dossier  personne ne veut m expliquer pourquoi je n ai toujours pas touche mes indemnites  alors que j ai fais toutes les demarches en temps et en heure  un manque de professionnalisme et d humanite totale ;1;['repondent', 'mettent', 'docu', 'retard', 'dossi', 'person', 'indemnit', 'demarch', 'professionnal', 'humanit', 'total'];repondent mettent docu retard dossi person indemnit demarch professionnal humanit total;-1
fermer l apres midi c est dommage;1;['ferm'];ferm;2
j ai eu dame au telephone du service  indemnisation   du val de marne fort malpolie et desagreable  qui a pretexte des problemes de reseaux et m a raccroche au nez apres   du mal a y croire vu son ton condescendant des les premieres secondes de l appel ;1;['servic', 'indemnis', 'val', 'marn', 'malpol', 'pretext', 'reseau', 'raccroch', 'nez', 'condescend', 'premier', 'second'];servic indemnis val marn malpol pretext reseau raccroch nez condescend premier second;2
accueil telephonique tres agreable  tres bon suivi du dossier  pour les avoir eu au telephone plusieurs fois je suis ravie des echanges que j ai pu avoir avec eux  les renseignements sont clairs  ca change des precedentes experiences que j ai pu avoir avec d autres agences dans l herault ;1;['dossi', 'rav', 'clair', 'agenc', 'herault'];dossi rav clair agenc herault;-1
j appelle pour joindre une conseillere  qui me redirige vers une autre conseillere pour regler des problemes administratives qui ne se terminent jamais  le tout pour patienter 40 minutes et avoir personne au bout du fil  ca en dit long sur l organisation  je vais devoir me deplacer en agence avec mon handicap puisque c est pas possible que les choses soient faites si on s y deplace pas;1;['redirig', 'administr', 'terminent', 'patient', '40', 'person', 'fil', 'agenc', 'handicap'];redirig administr terminent patient 40 person fil agenc handicap;-1
toujours bien renseigner et accueilli par telephone je ne comprend pas les gens qui se plaignent allee faire un tour aux assedics de la poste 6 mois pour avoir une indemnite personne au telephone vous serez bien content de dependre du pole emploi    ;1;['plaignent', 'tour', 'assedic', 'indemnit', 'person', 'content', 'dependr'];plaignent tour assedic indemnit person content dependr;1
toujours tres bien recue quand j ai un rendez vous  malheureusement  ce n est pas toujours le meme conseiller qui suit mon dossier ;1;['suit', 'dossi'];suit dossi;-1
les conseillers de pole emploi villeurbanne ne servent a rien  ils ne repondent jamais aux mails ni ne vous rappellent pour honorer un entretien telephonique  de plus ils ne comprennent pas que lorsque vous etes personne a mobilite reduite et que vous dependez des transports en commun c est difficile de se rendre aux entretiens   c est une honte  ;1;['villeurbann', 'repondent', 'rappellent', 'honor', 'comprennent', 'person', 'reduit', 'depend', 'transport'];villeurbann repondent rappellent honor comprennent person reduit depend transport;-1
le pire service 3h50 d attente sur le repondeur  personne ne repond  les bureaux sont fermes quand ils devraient etre ouvert  pfff   ;1;['servic', '3h50', 'repondeur', 'person', 'bureau', 'ferm', 'ouvert', 'pfff'];servic 3h50 repondeur person bureau ferm ouvert pfff;-1
c est plus plus possible le 3949  lamentable;1;['3949'];3949;-1
au secretariat ils vous envoient bouler  il faut absolument s inscrire sur pole emploi donc quitter son poste pour obtenir une information alors que vous pouvez avoir la reponse par telephone en 2min au 3949   ne leur donnez pas de travail  appeler ce numero gratuit pour toute information vous verrez du personnel competent  ;1;['secretariat', 'envoient', 'boul', 'quitt', 'repons', '2min', '3949', 'gratuit', 'verr', 'personnel', 'competent'];secretariat envoient boul quitt repons 2min 3949 gratuit verr personnel competent;-1
nous attendons trop de temps au telephone  ;1;['attendon'];attendon;2
tres bonne experience  je remercie le conseiller que j ai eu au telephone et qui a debloque mon probleme en une journee  ;1;['debloqu'];debloqu;2
