Description;telephone;Description_2;Description_3;clusters
gros probleme d indemnisation a cause de mon employeur  j ai eu a faire a 2 dames a l accueil qui ont ete super  gentille  bienveillante   au moins quelqu un qui ont pris mes soucis au serieux   le 3949 a par s en prendre plein la tete jme demande bien a quoi ils servent  en tout cas je remercie vraiment l equipe de pole emploi digne  ;1;['indemnis', 'employeur', 'gentill', 'souc', '3949', 'tet', 'jme', 'equip', 'dign'];indemnis employeur gentill souc 3949 tet jme equip dign;-1
des incapables pas professionnel  1y pour les avoir au telephone et apres elle se permet de traiter les gens de mauvaise fois pour leur incapacite franchement a fuir;1;['1y', 'incapacit', 'fuir'];1y incapacit fuir;-1
desagreable et mauvais  si vous n avez besoin de rien appelez les    et au passage perder 3 4 heures au telephone ;1;['mauv', 'passag', 'perd'];mauv passag perd;2
lors de son appel la conseillere ne s interesse pas vraiment a mon projet professionnel  elle ne demande aucun renseignement aucun justificatif  et me dit qu il faut que je fasse paye ma formation avec mon cpf car le pole emploi ne payera pas  et attention on me dirige vers une formation qui a rien a voir avec ce que je veux faire et mes competences  encore une fois tres decu  je me demande a quoi sert ce truc au final  le pole emploi a juste contribue a me garder au chomage  en voulant m oriente vers ce qui les arranges et non pas par ce qui me plaie et faire ;1;['justif', 'fass', 'pay', 'format', 'cpf', 'pai', 'dirig', 'format', 'truc', 'contribu', 'gard', 'chomag', 'orient', 'arrang', 'plai'];justif fass pay format cpf pai dirig format truc contribu gard chomag orient arrang plai;1
quand au telephone on a une personne agreable qui nous confirme que je peux accompagner mon mari a son rdv et qu en arrivant on tombe sur une personne desagreable qui refuse que je rentre avec lui  il y a de quoi etre agacee sachant que j avais pris mon apres midi specialement pour cet entretien    et que d autres sont autorises   ;1;['person', 'confirm', 'rdv', 'arriv', 'person', 'agace', 'special', 'autoris'];person confirm rdv arriv person agace special autoris;-1
service indemnisation qui ne fait absolument pas son travail inscrit depuis avril 2020 on me dit que mon inscription est pris en compte en juin 2020 sauf que j ai toute les preuves qu il font n importe quoi et dise bien ce qu il veule pour bacler les dossier    demande des documents deja envoye plus de 20 fois     des reponses toute faite et qui ont rien a voir avec ce qu ils ont dit la veille en attendant j ai 1 mois dans le vent due a l incompetence de ces dernier mais je ne vais pas me laisser faire   la personne au bout du fil coupe la parole et meprisante desagreable soupire a tout bout de chant et ne veux absolument rien entendre pretextant que c est nous les con       mail et courrier envoye au directeur suite a l incompetence de ces derniers   bravo pole emploi la vous faite tres fort  ;1;['servic', 'indemnis', 'inscrit', 'compt', 'juin', 'preuv', 'veul', 'bacl', 'dossi', 'docu', 'repons', 'veil', 'attend', 'vent', 'du', 'incompetent', 'person', 'fil', 'coup', 'parol', 'mepris', 'soupir', 'chant', 'entendr', 'pretext', 'courri', 'directeur', 'incompetent', 'derni'];servic indemnis inscrit compt juin preuv veul bacl dossi docu repons veil attend vent du incompetent person fil coup parol mepris soupir chant entendr pretext courri directeur incompetent derni;1
au lieu de menacer ma fille d un avertissement de radiation pour un appel manque suite au mauvais fonctionnement reseau   ouais ca arrive     alors qu en plus elle sort d une formation de mars a juillet   et que la elle vient de debuter les vendanges        donc ouai vous allez recevoir le contrat via mail  aller donc faire des menaces aux personnes qui refusent vos formations ainsi que les vendanges et qui sont indemnises      ce qui n est pas le cas de ma fille      quand on change les conseilleres a longueur d annee il faudrait peut etre qu elle se mette les dossiers a jour dans leur crane   a bon entendeur    ;1;['fill', 'avert', 'mauv', 'reseau', 'ouais', 'format', 'juillet', 'vient', 'debut', 'vendang', 'ouai', 'contrat', 'person', 'refusent', 'format', 'vendang', 'indemnis', 'fill', 'longueur', 'dossi', 'cran', 'entendeur'];fill avert mauv reseau ouais format juillet vient debut vendang ouai contrat person refusent format vendang indemnis fill longueur dossi cran entendeur;1
des bon a rien  incapables de vous accompagner dans le processus de creation d entreprise   ils sont censes nous aider mais ne servent finalement a rien  conseiller qui doit vous rappeler mais qui ne le fait jamais  rdv pris a ma demande annules   pole emploi recrute  sur pole emploi ;1;['processus', 'rdv'];processus rdv;2
odieuses a l accueil telephonique  ;1;['odieux'];odieux;-1
rendez vous telephonique a 10h30  je crois que la conseillere m a oublie  j espere que le cafe n etait pas trop sucre   apres on dit que les jeunes ne veulent pas travailler   chapeau  ;1;['10h30', 'crois', 'caf', 'sucr', 'jeun', 'veulent', 'chapeau'];10h30 crois caf sucr jeun veulent chapeau;2
je ne peux pas donner d avis sur l accueil physique mais concernant les echanges mails et telephoniques  je n ai jamais ete aussi bien  accueillie   les reponses sont rapides  claires et respectueuses ;1;['repons', 'rapid', 'clair', 'respectu'];repons rapid clair respectu;2
plus inutile que vous   ca n existe pas  vos  conseilleres    absolument execrables et irrespectueuses  c est un pur scandale  j appelle un matin pour avoir un simple renseignement concernant une alternance  dans un domaine precis  car je debute dans le monde du travail et j aimerait quelques conseilles concernant les endroits ou faire mes recherches  je pose ma question en etant tres agreable malgre de longues minutes d attentes et un  bonjour  a peine audible articule   la reponse de la conseillere    euuh madame on vas pas trouver votre stage a votre place hein    attendez mais j hallucine   premierement ce n est pas un stage que je recherche mais une alternance     deuxiemement  pole emploi est un centre d information pour les formations et emplois   cette dame connait elle au moins son metier     troisiemement  a quel moment j ai appele pour que vous me trouviez quoi que ce soit   cela fait des mois que je fais mes propres recherches je n ai jamais reclame aucune aide  j appelais pour une simple information  apprenez a ecouter ce que les gens disent avant de dire d enormes m       et au passage  le respect c est pas a 50 piges qu on l acquiert  je ne vous parle meme pas de la suite de la conversation ou cette dame s est vite mise a me parler de facon agressive  j ai evidemment raccroche et c est bien la derniere fois que j ai a faire a vous car vous etes les pires de tous dans le domaine  j espere que l affreuse dame a qui j ai parle est moins frustree depuis  sinon  c est vraiment triste comme vie  bizous;1;['execr', 'irrespectu', 'pur', 'scandal', 'altern', 'prec', 'debut', 'endroit', 'audibl', 'articul', 'repons', 'euuh', 'vas', 'hein', 'attend', 'hallucin', 'premier', 'altern', 'format', 'troisiem', 'propr', 'reclam', 'appren', 'disent', 'passag', 'respect', '50', 'pig', 'acquiert', 'agress', 'raccroch', 'pir', 'affreux', 'frustre', 'trist', 'bizous'];execr irrespectu pur scandal altern prec debut endroit audibl articul repons euuh vas hein attend hallucin premier altern format troisiem propr reclam appren disent passag respect 50 pig acquiert agress raccroch pir affreux frustre trist bizous;1
mon compagnon s est inscrit au mois de fevrier  jamais il n a pu rencontrer le moindre agent de pole emploi  uniquement des entretiens telephoniques hatifs  aucune proposition d emploi  on l a juste oriente vers une de ces agences privees censees assurer une orientation vers une formation professionnelle  des tests ridicules niveau college  la aussi par telephone et aucun resultat tangible   son emploi  en cdi  il se l est trouve tout seul  l argent du chomage et de la formation continue est bien mal utilise et les chomeurs semblent bien peu consideres   ;1;['compagnon', 'inscrit', 'agent', 'hatif', 'orient', 'agenc', 'prive', 'cense', 'assur', 'orient', 'format', 'test', 'ridicul', 'colleg', 'tangibl', 'cdi', 'argent', 'chomag', 'format', 'semblent'];compagnon inscrit agent hatif orient agenc prive cense assur orient format test ridicul colleg tangibl cdi argent chomag format semblent;1
telephone inutile  juste pour faire serieux ;1;[];;-1
tres bon premier contact avec mon conseiller qui m a donne toutes les informations dont j avais besoin  et plus ;1;['contact'];contact;0
bilan de deux annees  pole emploi   3 conseilleres consecutives  rdv avec la premiere qui m explique tout  je me sens en confiance  puis au bout de qq mois  je decouvre  que j ai une nouvelle conseillere avec qui je n ai eu qu un rdv telephonique  quant a la 3eme  elle m est totalement inconnue  je demande des aides administratives pour la creation de ma micro entreprise  reponse   il n y en a pas  la deuxieme m inscrit a une formation sur ma demande mais je decouvre par la conseillere en charge de la formation qu une fois votre me declaree  vous n avez plus droit aux formations   info que l on ne m a pas donne en amont  ca aurait ete sympa  pire  ma conseillere attitree me propose de fermer ma me  de faire la formation et de la reouvrir apres  certes    du coup  je n ai au droit a aucune formation et je me debrouille toute seule pour le developpement de ma me pire j ai travaille 2 semaines en entreprise  resultat   votre salaire est deduit des indemnites donc en fin de mois    une indemnite diminuee avec du stress en plus et de l essence en moins  c est quoi deja le boulot de pole emploi  ;1;['consecut', 'rdv', 'qq', 'decouvr', 'rdv', '3em', 'inconnu', 'administr', 'micro', 'repons', 'inscrit', 'format', 'decouvr', 'format', 'format', 'info', 'amont', 'attitre', 'ferm', 'format', 'reouvr', 'cert', 'format', 'debrouill', 'developp', 'salair', 'deduit', 'indemnit', 'indemnit', 'diminue', 'stress', 'essenc', 'boulot'];consecut rdv qq decouvr rdv 3em inconnu administr micro repons inscrit format decouvr format format info amont attitre ferm format reouvr cert format debrouill developp salair deduit indemnit indemnit diminue stress essenc boulot;1
appel pour un renseignement standardiste tres mal eleve je le dis incorrect ne laisse pas parler et ce prend de haut franchement pole emplois fermer de bon a rien ;1;['standard', 'elev', 'incorrect', 'haut', 'ferm'];standard elev incorrect haut ferm;-1
votre temps d attente est estimee a moins d une minute  j ai raccroche au bout de 10min d attente  ;1;['estime', 'raccroch', '10min'];estime raccroch 10min;-1
appel pour un renseignement standardiste tres mal eleve je le dis incorrect ne laisse pas parler et ce prend de haut franchement pole emplois fermer de bon a rien ;1;['standard', 'elev', 'incorrect', 'haut', 'ferm'];standard elev incorrect haut ferm;-1
votre temps d attente est estimee a moins d une minute  j ai raccroche au bout de 10min d attente  ;1;['estime', 'raccroch', '10min'];estime raccroch 10min;-1
c est la meilleure de l annee      j ai jamais annule mon rdv je recois un message qui me dis vous avez fait une demande de report        en plus impossible de vous joindre    ;1;['meilleur', 'rdv', 'report'];meilleur rdv report;2
accueil froid et desagreable par telephone  ils se moquent des gens car demandent le meme document 5 fois en disant que ce n etait pas le bon et finalement quand j ai demande juste de lire attentivement on me dit   ah oui c est bien celui la    manque de competences de certains conseillers  qui ne savent pas compter ou lire  ni ecouter  comment on les embroche   ma conseillere qui ne repond pas aux mails et les conseillers qui ne transmettent pas les documents en retardant le payement  bravo  il faut etre plus humain meme envers les etrangers ;1;['froid', 'moquent', 'demandent', 'docu', 'ah', 'savent', 'compt', 'embroch', 'transmettent', 'docu', 'retard', 'pai', 'enver', 'etranger'];froid moquent demandent docu ah savent compt embroch transmettent docu retard pai enver etranger;2
travaillant depuis plusieurs annees sans avoir eu besoin d aide  suite a une reconversion professionnelle  j appelle pour des renseignements et la conseillere s engage a me contacter a nouveau l apres midi meme  cela fait 15 jours que j attends son appel  sa fait plaisir de savoir pour quoi et pour qui je me leve le matin  je comprends mieux pourquoi le chomage ne baisse pas si ce sont ce genre de personne qui doivent accompagner ;1;['reconvers', 'engag', 'contact', 'attend', 'plais', 'lev', 'chomag', 'baiss', 'person'];reconvers engag contact attend plais lev chomag baiss person;0
abominable   impossible de les avoir ;1;['abomin'];abomin;2
bonjour a tous les internautes   et voila malgre multiples appel a pole emploi conseiller devait me contacter mais apparemment doivent etre surbookee   lol  je ne compte plus sur cette organisme a bout de souffle  j ai fait demarche seul en me payant formation avec mon cpf   et ensuite j ai deja plusieurs offres d emplois mais pas grace a pole emploi seul moi ayant fait demarche sans aucun soutien   et comme a chaque fois pole emploi se limite a radier les personnes pour statistiques  c est simple passer a l agence de saint avold et vous constaterez comme sa bosse tres tres dur  franchement decu et outre par leur manque de parole   donc comme d habitude il faut se debrouiller seul pour emploi  une reorganisation totale de l agence serait pas du luxe   et qu on reponde a mon avis et la je vais prouver qu une personne motivee a travailler est mis de cote sans suivie et empathie   mais bon que peut t on faire a notre niveau   c est simple se debrouiller par ses propres moyens comme a chaque fois  salutations distinguees  ;1;['internaut', 'contact', 'apparent', 'surbooke', 'lol', 'compt', 'souffl', 'demarch', 'pai', 'format', 'cpf', 'offre', 'demarch', 'soutien', 'radi', 'person', 'statist', 'agenc', 'saint', 'avold', 'constat', 'boss', 'outr', 'parol', 'habitud', 'debrouill', 'reorganis', 'total', 'agenc', 'lux', 'prouv', 'person', 'motive', 'empath', 'debrouill', 'propr', 'salut', 'distingue'];internaut contact apparent surbooke lol compt souffl demarch pai format cpf offre demarch soutien radi person statist agenc saint avold constat boss outr parol habitud debrouill reorganis total agenc lux prouv person motive empath debrouill propr salut distingue;1
une vieille dame aigrie  m appelle pour mon ami qui n a actuellement plus de telephone  je lui explique calmement que je suis indisposee a dire a mon ami qu il a un appel car je suis tout comme elle sur mon lieu de travail  donc ne suis pas a mon logement  elle me raccroche directement a la gu eule   changer d entreprise madame ou mettez vous a la retraite  car vous vous etes completement trompee de voix professionnelle  ;1;['vieil', 'aigr', 'ami', 'calm', 'indispose', 'ami', 'log', 'raccroch', 'gu', 'eul', 'retrait', 'trompe', 'voix'];vieil aigr ami calm indispose ami log raccroch gu eul retrait trompe voix;2
injoignables le matin par telephone sur les heures d ouverture  il ne faut pas avoir besoin de conseils    redirigee vers le standard ;1;['injoign', 'ouvertur', 'redirige', 'standard'];injoign ouvertur redirige standard;2
tres bon accueil  disponibilite et courtoisie  ils repondent meme le dimanche par mail   sourire telephonique  traitement immediat ou a peine differe de quelques heures  patience et reactivite  malgre nombreuses demandes formulees  j en suis si etonnee que j ai decide de le noter ici dans l espoir qu ils le lisent egalement  on ne le dit pas assez quand les agents font un bon travail  merci a vous ;1;['disponibilit', 'courtois', 'repondent', 'dimanch', 'sourir', 'immediat', 'differ', 'patienc', 'reactivit', 'nombreux', 'formule', 'etonne', 'espoir', 'lisent', 'agent'];disponibilit courtois repondent dimanch sourir immediat differ patienc reactivit nombreux formule etonne espoir lisent agent;1
se sont pas des personne irresponsables quand ils font des erreurs ils refuse de reconnaitre ils m ont demande de rembourse de l argent que j ai ne pas recu et le soit disant responsable de pole emploi      n a rien a faire il te dit appeller 3949 et quand tu appelles ils te repondent je sais pas madame vous avez forcement faire une fausse de declaration sans meme verifier je suis au chomage depuis octobre 2021  j ai deja rembourse 1094  64 euros et la encore  ils me demandent de rembourser 129 euro     que je n ai jamais vu la couleur;1;['person', 'irrespons', 'reconnaitr', 'rembours', 'argent', 'respons', '3949', 'repondent', 'declar', 'chomag', 'rembours', '1094', '64', 'euros', 'demandent', 'rembours', '129', 'couleur'];person irrespons reconnaitr rembours argent respons 3949 repondent declar chomag rembours 1094 64 euros demandent rembours 129 couleur;-1
j ai essaye d appeler pour la premiere fois sur leur numero avec le mien  qui leur etait donc inconnu  et la reponse automatique etait  bonjour  pole emploi a essaye de vous joindre  si vous n avez pas ete en contact avec  pole emploi depuis ce message  merci de rappeler le 3949     grosse blague;1;['mien', 'inconnu', 'repons', 'contact', '3949', 'gross', 'blagu'];mien inconnu repons contact 3949 gross blagu;0
les conseillere telephonique du 3949 pas du tout emable ce n est pas professionnel  c est bien dommage  par contre mon conseiller et top;1;['3949', 'emabl', 'top'];3949 emabl top;-1
j ai apprecier que l on me donne des renseignements apres ma rupture conventionnelle dans la fonction public  sans rendez vous et que l on m a rappeler pour me donner toutes les informations   merci pole emploi st genevieve des bois   contrairement a d autres pole emploi ou j ai ete tres mal recu   encore merci a toute l equipe de st genevieve des bois ;1;['appreci', 'conventionnel', 'st', 'geneviev', 'bois', 'equip', 'st', 'geneviev', 'bois'];appreci conventionnel st geneviev bois equip st geneviev bois;2
tres bon accueil  disponibilite et courtoisie  ils repondent meme le dimanche par mail   sourire telephonique  traitement immediat ou a peine differe de quelques heures  patience et reactivite  malgre nombreuses demandes formulees  j en suis si etonnee que j ai decide de le noter ici dans l espoir qu ils le lisent egalement  on ne le dit pas assez quand les agents font un bon travail  merci a vous ;1;['disponibilit', 'courtois', 'repondent', 'dimanch', 'sourir', 'immediat', 'differ', 'patienc', 'reactivit', 'nombreux', 'formule', 'etonne', 'espoir', 'lisent', 'agent'];disponibilit courtois repondent dimanch sourir immediat differ patienc reactivit nombreux formule etonne espoir lisent agent;1
j ai essaye d appeler pour la premiere fois sur leur numero avec le mien  qui leur etait donc inconnu  et la reponse automatique etait  bonjour  pole emploi a essaye de vous joindre  si vous n avez pas ete en contact avec  pole emploi depuis ce message  merci de rappeler le 3949     grosse blague;1;['mien', 'inconnu', 'repons', 'contact', '3949', 'gross', 'blagu'];mien inconnu repons contact 3949 gross blagu;0
les conseillere telephonique du 3949 pas du tout emable ce n est pas professionnel  c est bien dommage  par contre mon conseiller et top;1;['3949', 'emabl', 'top'];3949 emabl top;-1
tres decue  ma conseillere n etait pas tres investie  plusieurs appels  plusieurs relances  derniers mails sans reponse       je me suis retrouvee en fin de droit sans infos ni ressources  j aurais pense etre mieux accompagnee ;1;['invest', 'derni', 'repons', 'retrouve', 'infos', 'ressourc', 'accompagne'];invest derni repons retrouve infos ressourc accompagne;-1
injoignable     tele travail ou non le telephone eux ne le decroche jamais;1;['injoign', 'tel', 'decroch'];injoign tel decroch;-1
dommage que l on soit oblige de mettre une etoile  j ai mis 2 mois a me faire indemniser car ma conseillere ne comprenait rien a mon dossier et me disait que je n avais pas le droit aux allocations car je n avais pas assez travaille hors que je n ai eu aucune interruption depuis plus de 7 ans   ils m ont ensuite radier par erreur et m ont envoye une mise en demeure disant que je ne m etais pas presentee a un rendez vous physique alors que le rendez vous a bien eu lieu mais par telephone comme cela etait convenu   une fois en agence la conseillere m indique que je dois faire une reclamation par courrier avec une demande retroactive  choses a laquelle je lui ai repondu qu il en etait hors de question car il s agissait d une erreur de leur part et quand on fait des erreurs on les repare   je leur ai dit que je ne bougerai pas tant que je ne verrai pas un responsable  et cette personne a reussi a regler l ensemble de mes problemes en 3 jours   c est quand meme dingue que l on ai a leur apprendre leur metier    a aujourd hui je souhaite faire une formation dans le but eventuellement de me mettre a mon compte mais aucun creneau de disponible que ce soit en presentiel en visio ou par telephone   je ne comprends vraiment pas quel est le role de pole emploi a part nous donner des cheveux blancs et puiser sur notre sante mentale     bref  vraiment peu qualifie et peu consciencieux  ca craint beaucoup ;1;['indemnis', 'compren', 'dossi', 'alloc', 'hor', 'interrupt', 'radi', 'demeur', 'presente', 'convenu', 'agenc', 'reclam', 'courri', 'retroact', 'hor', 'agiss', 'repar', 'boug', 'verr', 'respons', 'person', 'ensembl', 'dingu', 'apprendr', 'format', 'but', 'eventuel', 'compt', 'creneau', 'presentiel', 'visio', 'rol', 'cheveux', 'blanc', 'puis', 'sant', 'mental', 'qualif', 'conscienci', 'craint'];indemnis compren dossi alloc hor interrupt radi demeur presente convenu agenc reclam courri retroact hor agiss repar boug verr respons person ensembl dingu apprendr format but eventuel compt creneau presentiel visio rol cheveux blanc puis sant mental qualif conscienci craint;1
je travail depuis 2002 avec quelques passage via pole emploi   j ai arreter mon ancien metier en mai 2020   j ai etait malade pendant 5 mois et en stand bye pendant 2 mois   j ai perdue de l argent a cause de sa arret maladie de quatre jours   puis j ai effectuer une formation en debut d annee 2021que jai reussi et depuis se temps je recherche du travail   en fevrier 2022 j ai trouver un cdd de deux mois et demi   et depuis je suis a la recherche mais fin de droit se termine dici quelques jour   durant mon chomage j ai eu l occasion de voir ma conseiller que5 6 fois par mail et quelque fois par telephone    elle m a envoyer une annonce qu au finale c etait negatif  je n est eu aucune autre aide de sa par   pole emploi m a proposer de faire un vsi en fin d are et je doit etre seule pour faire ma demarche pour rechercher du taff   je veux bien etre comprehensible  mais la sa m enerve en sachant que je suis active dans ma recherche d emploi  ;1;['2002', 'passag', 'malad', 'stand', 'bye', 'perdu', 'argent', 'malad', 'quatr', 'format', '2021que', 'cdd', 'dem', 'dic', 'chomag', 'occas', 'que5', 'vsi', 'demarch', 'taff', 'comprehensibl', 'enerv'];2002 passag malad stand bye perdu argent malad quatr format 2021que cdd dem dic chomag occas que5 vsi demarch taff comprehensibl enerv;1
conseiller sympa lors du premier rdv en face a face  mais apres  zero retours a mes e mails et impossible de les joindre  malgre un engagement de nous repondre sous 48h ouvrees ;1;['rdv', 'fac', 'fac', 'e', 'engag', '48h', 'ouvre'];rdv fac fac e engag 48h ouvre;1
impossible d obtenir un rdv physique  que du telephone ou de la visio  quand il reste des creneaux disponibles  3949 c est une plate forme  pas de contact direct avec des gens de l agence  en plus pas franchement aimables ;1;['rdv', 'visio', 'creneau', 'disponibl', '3949', 'plat', 'contact', 'agenc', 'aimabl'];rdv visio creneau disponibl 3949 plat contact agenc aimabl;0
catastrophique radier pour avoir rate 2 appels telephonique j ai pourtant prevenu mon conseiller que mon telephone etant defectueux je ne l entendais pas sonne   je fait une lettre de recours pour expliquer que j avais convenue avec mon conseiller un bilan de competence et que le devis et en attente j ai recu l accuser de reception j ai jamais eu de reponse   je me reinscris apres ma radiation je vais en agence car je n arrive pas a valider le devis depuis plusieurs semaines    4 interlocuteurs personne sait comment faire sois disant un bug   ce qui es faux j avais apeller le support technique   ont m envoie chez une conseillere qui sait meme pas rejoindre une reunion sur zomm   entre temps j avais recu un apel pour me changer de conseiller    je croise mon conseiller et lui demande la raison  c est comme ca c est des decision en interne je lui dit que je refuse car nous avions deja convenue du bilan de competences   il me dit que je n ai pas le choix   je repars agacer sans avoir reussit a valider le devis   j y arrive par moi meme quelques jours plus tard  j harcele mon conseiller par mail pour qu il me reponde ce qu il en ai pour la validation du bilan  et la il me repond quoi   que ce ne seras pas financer qu il faut que j aille faire active projet que j ai deja fait 5 avant     monsieur jean luc petit m as fait perdre mon temps depuis le mois de janvier  il es incompetent et mensonger   attente j ai recu l accuse j ai jamais eu de reponse;1;['radi', 'rat', 'prevenu', 'defectu', 'entend', 'son', 'recour', 'convenu', 'competent', 'accus', 'repons', 'reinscr', 'agenc', 'interlocuteur', 'person', 'bug', 'apel', 'support', 'rejoindr', 'zomm', 'apel', 'crois', 'decis', 'intern', 'convenu', 'repar', 'agac', 'reuss', 'harcel', 'financ', 'aill', 'jean', 'luc', 'incompetent', 'mensong', 'accus', 'repons'];radi rat prevenu defectu entend son recour convenu competent accus repons reinscr agenc interlocuteur person bug apel support rejoindr zomm apel crois decis intern convenu repar agac reuss harcel financ aill jean luc incompetent mensong accus repons;1
