Description;telephone;Description_2;Description_3;clusters
une entreprise m a propose d effectuer une periode de mise en situation en milieu professionnel  pmsmp   j ai fait une demande de mobilite aupres du pole emploi de la ville de capesterre belle eau  les agents du pole emploi m avaient affirmes que les demandes de mobilites sont traitees en 72h  c est la deuxieme fois que le pole emploi ne traite pas ma demande dans les delais  je ne peux pas me rendre a mon rendez vous d embauche a cause du pole emploi ;1;['milieu', 'pmsmp', 'capesterr', 'eau', 'agent', 'affirm', 'traite', '72h'];milieu pmsmp capesterr eau agent affirm traite 72h;-1
je pense que pour ameliorer le site  de maniere optimum  les demandeurs d emploi doivent avoir plus de facilites pour remplir leurs fiches de fin de mois    car cela a ete bete pour ma part d etre reste sans inscription 2 mois   j avais un probleme de pointage c est pour cela que je suis reste a l ecart depuis le 15  janvier dernier   je signale que je ne touche a ce jour  ni rsa ni chomage  je vis au jour le jour  et toujours sans emploi   mon permis de conduire n est plus valide   il me faut repasser  la visite medicale   autrement tout est en regle;1;['optimum', 'bet', 'pointag', 'ecart', 'rsa', 'chomag', 'conduir', 'repass', 'visit', 'medical', 'autr'];optimum bet pointag ecart rsa chomag conduir repass visit medical autr;-1
j ai effectue une demande d aide a la mobilite pour aller a une convocation d entretien d embauche le 11 avril 2022  j ai correctement suivi les instructions du pole emploi concernant la procedure de cette demande  les employes du service 3949 m ont dit que l es demandes de mobilite etait traitees en 72h maximum  mon entretien d embauche a ete fixe pour la date du 21 avril 2022   les delais de traitement ne sont pas respectes par le pole emploi  cela fait 4 jours que ma demande est en attente de traitement  je me suis deplacee a l accueil du pole emploi de la ville de capesterre belle eau  les employes ont refuse de m apporter une reponse claire sur ma demande de mobilite ;1;['convoc', '11', 'instruct', 'procedur', 'servic', '3949', 'traite', '72h', 'maximum', 'fix', '21', 'respect', 'deplace', 'capesterr', 'eau', 'apport', 'repons'];convoc 11 instruct procedur servic 3949 traite 72h maximum fix 21 respect deplace capesterr eau apport repons;-1
je suis demandeur d emploi de la ville de capesterre belle eau depuis le 14 fevrier 2018  j ai ete convoque par une entreprise pour un entretien d embauche 11 jours avant la date du rendez vous  j ai effectue une demande de mobilite a partir de mon espace de demandeur d emploi 11 jours avant ma date de rendez vous  les employes du pole emploi au numero de telephone 3639 m ont affirme que les demandes de mobilites sont traitees en 72h  ma demande de mobilite pour un entretien d embauche n a pas ete traitee  j ai ete penalise par le manque de professionnalisme du pole emploi de la ville de capesterre belle eau  un agent du pole emploi m a recu au pole emploi le jour de mon entretien d embauche  ces explications concernant la deterioration de ma demande de mobilite n etaient pas coherentes ;1;['capesterr', 'eau', '14', '2018', 'convoqu', '11', '11', '3639', 'affirm', 'traite', '72h', 'traite', 'penalis', 'professionnal', 'capesterr', 'eau', 'agent', 'deterior', 'coherent'];capesterr eau 14 2018 convoqu 11 11 3639 affirm traite 72h traite penalis professionnal capesterr eau agent deterior coherent;-1
mon actualisation n a pas ete prise en compte   une erreur sans doute avec un appel au domicile me prevenant de m actualiser  pour rien car deja actualise  comme quoi encore un service de plus qui beugue   vive internet   ;1;['compt', 'preven', 'servic', 'beugu', 'viv', 'internet'];compt preven servic beugu viv internet;-1
lors de l ouverture d une enieme reclamation a pole emploi  le service reste bloque sur  reessayez ulterieurement   du coup  on reessaie ulterieurement et cela ne fonctionne toujours pas  et pour cause   la vrai raison de ce blocage  pole emploi n accepte plus les reclamations de gens en ayant  trop  effectue  15 problemes  15 reclamations  interdiction de signaler le 16eme ;1;['ouvertur', 'eniem', 'reclam', 'servic', 'ulterieur', 'ulterieur', 'blocag', 'reclam', 'reclam', 'interdict', '16em'];ouvertur eniem reclam servic ulterieur ulterieur blocag reclam reclam interdict 16em;-1
bonjour  le service pole emploi se degrade fortement  je me retrouve continuellement impactees  je respecte toute les conditions et honore chacune de mes obligations  par le manque de professionnalisme de certains par telephone  mepris  informations trompeuses  l info est errone d une personne a une autre  on me raccroche au nez    aucune empathie  quel dommage  3 mois sans remuneration  cela entraine de grosses difficultes ;1;['servic', 'degrad', 'continuel', 'impacte', 'respect', 'condit', 'honor', 'professionnal', 'mepr', 'trompeux', 'info', 'erron', 'person', 'raccroch', 'nez', 'empath', 'remuner', 'entrain', 'gross'];servic degrad continuel impacte respect condit honor professionnal mepr trompeux info erron person raccroch nez empath remuner entrain gross;-1
dans le cadre d une inscription et d une demande d allocations de chomage  impossible de transferer les pieces du domicile car scanner  domestique   qualifie ainsi par pole emploi  rejet de ces memes pieces pourtant scannees et verifiees par le personnel en agence  aucune transmission de coordonnees telephoniques ou electroniques du conseiller donc impossible d avoir un interlocuteur unique  accueil standardise et a la limite de la robotisation ;1;['alloc', 'chomag', 'transfer', 'domest', 'qualif', 'scanne', 'verifie', 'personnel', 'agenc', 'electron', 'interlocuteur', 'uniqu', 'standardis', 'robotis'];alloc chomag transfer domest qualif scanne verifie personnel agenc electron interlocuteur uniqu standardis robotis;-1
je suis penalisee par pole emploi   une societe souhaitait me rencontrer pour mettre en place un projet professionnel  les employes du pole emploi ne traitent pas mes demandes de pmsmp et de mobilite  ils ne repondent pas a mes courriels  appels et reclamation ;1;['penalise', 'traitent', 'pmsmp', 'repondent', 'courriel', 'reclam'];penalise traitent pmsmp repondent courriel reclam;-1
apres avoir fourni mes  attestatons employeurs  pour le calcul de mes droits a une indemnisation a pole emploi   mon dossier est bloque suite a une mauvaise manipulation creant un dysfonctionnement technique   sans revenus depuis 2 mois j attends avec pour seul interlocuteur une plateforme qui fait passer le message a mon conseiller  qui lui n a pas la main sur mon dossier qui fait passer passer le message a un technicien etc  ;1;['attestaton', 'employeur', 'indemnis', 'dossi', 'manipul', 'revenus', 'attend', 'interlocuteur', 'plateform', 'main', 'dossi', 'technicien'];attestaton employeur indemnis dossi manipul revenus attend interlocuteur plateform main dossi technicien;2
je suis demandeur d emploi de l ile de la guadeloupe  j ai ete convoque par une entreprise pour un entretien d embauche en metropole  l employeur demande en plus de pouvoir voir mes capacites a ce poste  j ai donc fait une demande d aide a la mobilite destinee au demandeur d emploi a partir de mon espace utilisateur pole emploi  j ai constate que la date fixe par l entreprise se rapprochait  je suis allee a l agence pole emploi directement pour demander des informations sur le suivi de ma demande de mobilite  les employes du pole emploi se sont exclamee que les demandes de mobilite sont appliquees uniquement sur l ile de la guadeloupe  ces employes ont affirme que le dispositif aide a la mobilite n est pas destine au deplacement en metropole  cet employe n a pas su me montrer les textes du pole emploi qui lui permettent de dire que l aide a la mobilite est refuse pour la metropole  a cause du pole emploi  je n ai pas pu etre a mon entretien d embauche comme l avait demande l entreprise ;1;['ile', 'guadeloup', 'convoqu', 'metropol', 'employeur', 'capacit', 'destine', 'fix', 'rapproch', 'agenc', 'exclame', 'applique', 'ile', 'guadeloup', 'affirm', 'destin', 'metropol', 'montr', 'permettent', 'metropol'];ile guadeloup convoqu metropol employeur capacit destine fix rapproch agenc exclame applique ile guadeloup affirm destin metropol montr permettent metropol;2
une entreprise m a propose d effectuer une pmsmp dans ces locaux  ma conseillere pole emploi a valide une pmsmp avec des horaires de travail identiques a ceux des employes  la convention precise pourtant que les horaires d une pmsmp ne doivent pas etre identique aux employes ;1;['pmsmp', 'pmsmp', 'horair', 'ident', 'convent', 'horair', 'pmsmp', 'ident'];pmsmp pmsmp horair ident convent horair pmsmp ident;1
pole emploi fait barrage a mes candidatures  comme celle a laquelle j ai repondu aujourd hui et qui a ete aussitot refusee pour un motif non recevable   j ai aussitot cherche a joindre quelqu un a l agence de caen  notamment mon  conseiller  qui est injoignable     et  inutile  ou bien quelqu un a qui je pourrais exposer la situation  eh bien c est mission impossible  pole emploi est un fantome     en consequence  je constate que pole emploi ne veut pas me donner une chance de travailler et prefere que je reste chez moi   que dire  ;1;['barrag', 'aussitot', 'recev', 'aussitot', 'agenc', 'caen', 'injoign', 'expos', 'eh', 'fantom', 'prefer'];barrag aussitot recev aussitot agenc caen injoign expos eh fantom prefer;1
bonjour   les conseillers pole emploi transforment tout au telephone  ce qui fait perdre du temps aux chercheurs d emploi  n etant pas vaccine par exemple je ne puis plus travailler dans le secteur medico social  or ma conseillere pole emploi a ecrit sur le rapport de transmission que j etais a la recherche d un emploi dans ce secteur la  au lieu de me fournir des connaissances dans le domaine qui me plait  et dans lequel je souhaite me reconvertir  par ailleurs j ai demande si j avais le droit un rattrapage en anglais avec ma formation cpf et toujours aucune nouvelle depuis a peu pres deux semaines  voila et cela depuis au moins 15 ans  pole emploi est une institution qui isole les plus pauvres socialement  et qui  fait perdre du temps aux 20 35 ans ;1;['transforment', 'chercheur', 'vaccin', 'medico', 'plait', 'lequel', 'reconvert', 'rattrapag', 'anglais', 'format', 'cpf', 'institu', 'isol', 'pauvr', '35'];transforment chercheur vaccin medico plait lequel reconvert rattrapag anglais format cpf institu isol pauvr 35;-1
bonjour  je viens vers vous pour partager l evolution rapide apres un rendez vous telephonique prevu le 12mai a 9h  j avais beaucoup de questions concernant mon projet professionnel et aussi mon embauche qui etait le 01 mai 2022 je de devais egalement poser concernant le permis  a ma grande surprise une lettre de rappel m attestant de ne pas avoir honore mon rendez vous   coup de theatre   radiation de mon  inscription a pole emploi  ;1;['partag', 'evolu', 'prevu', '12mai', '9h', '01', 'pos', 'attest', 'honor', 'theatr'];partag evolu prevu 12mai 9h 01 pos attest honor theatr;1
je rencontrais des problemes avec mon dossier pole emploi  ce qui a bloque mon indemnisation pendant plusieurs mois alors que j avais le droit de la percevoir  ma conseillere m a raconte beaucoup de choses pour justifier le rejet de mon dossier  tout son argumentaire s est revele etre totalement faux   elle m a egalement fait constituer des dossiers qui n ont abouti a rien  dans quel but  je n en ai aucune idee   la majorite de nos echanges se sont faits par telephone  heureusement j ai fini par tomber sur quelqu un qui a pris au serieux ma demande et a regle le probleme en quelques heure  ma conseillere m a laisse des mois dans cette situation  heureusement que je ne vis pas seule car sinon je ne pouvais plus me nourrir ni me loger  etant enceinte  cela aurait pu avoir de tres graves repercussions   ;1;['dossi', 'indemnis', 'percevoir', 'racont', 'dossi', 'argumentair', 'revel', 'constitu', 'dossi', 'about', 'but', 'ide', 'majorit', 'tomb', 'nourr', 'log', 'enceint', 'grav', 'repercuss'];dossi indemnis percevoir racont dossi argumentair revel constitu dossi about but ide majorit tomb nourr log enceint grav repercuss;-1
inscrite depuis bientot un an je n ai jamais rencontre mon conseiller    je l ai sollicite a deux reprises par mail pour m aider au financement de ma formation qui a ete refusee en mars sans motif valable  il devait me rappeler pour me proposer une formation financable et coherente avec mon parcours mais depuis je n ai aucune nouvelle    lorsque je souhaite prendre un rendez vous il n y a jamais de creneau disponible    j ai besoin de rencontrer mon conseiller physiquement pour faire le point avec lui ;1;['inscrit', 'bientot', 'financ', 'format', 'valabl', 'format', 'financ', 'coherent', 'creneau'];inscrit bientot financ format valabl format financ coherent creneau;0
bonjour  j ai malheureusement eu l experience d avoir a faire a pole emploi   un mot les concernant  honteux  je bosses depuis 25 ans  l entreprise dans laquelle je travaillais a mis la cles sous la porte il y a presque 3 mois en arriere  mes indemnites qui me sont payes ne sont pas juste  il manque 500 euros    apparemment des documents que j avais fourni se sont perdus  donc j ai renvoye  par mail bien sur car les courriers postaux sont beaucoup beaucoup moins bien traite  je rappel quand meme que je n ai pas d ordinateur et que c est une amie qui fait les demarches pour moi sur son temps libre car elle travaille   j ai ete oblige de rappeler car pas de nouvelle  on me dit qu ils n ont pas recu les documents  qu il faut passer par mon espace pour les envoyer  ce que je fais  toujours par le biais de mon amie  d ailleurs grosse galere car oblige d envoyer les docs 2 par 2 et j en ai une trentaine a envoyer  pour la plus part des docs le site m indique qu ils sont pas pris en compte car mauvais intitule  donc je rappelle pole emploi   quand j explique ma situation que je n ai pas d ordinateur   la personne ne repond que je ne fais pas d efforts et me menace de  raccrocher quand elle entend mon amie derriere moi dire qu il faudrait revoir la facon de faire les choses  sur un ton tres calme   donc bien sur je suis reste calme au telephone car pas envie de devoir rester encore 15 min au telephone avant d avoir quelqu un    en clair 25 ans en activite  3 mois de chomage  j ai retrouve du travail  avec des indemnites aux rabais pas  ordinateur mais me debrouille pour faire les memes demarches plusieurs fois sur ordi quand meme  j explique que ca ne va plus etre possible car mon amie a autre chose a faire toujours calmement  et on me repond que je ne fais pas d effort  et bien pole emplois n a qu a me payer un ordinateur et internet parce que avec 500 euros de moins par moi pour vivre et bien c est compliquer d aller m en acheter un  je ne felicite pas pole emploi et ses conseillers ;1;['boss', 'cle', 'arrier', 'indemnit', 'pay', '500', 'euros', 'apparent', 'docu', 'perdus', 'renvoy', 'courri', 'postal', 'ami', 'demarch', 'libr', 'docu', 'bi', 'ami', 'gross', 'galer', 'trentain', 'compt', 'mauv', 'intitul', 'person', 'effort', 'raccroch', 'entend', 'ami', 'derrier', 'revoir', 'calm', 'calm', 'min', 'chomag', 'indemnit', 'rab', 'debrouill', 'demarch', 'ordi', 'ami', 'calm', 'effort', 'pai', 'internet', '500', 'euros', 'achet', 'felicit'];boss cle arrier indemnit pay 500 euros apparent docu perdus renvoy courri postal ami demarch libr docu bi ami gross galer trentain compt mauv intitul person effort raccroch entend ami derrier revoir calm calm min chomag indemnit rab debrouill demarch ordi ami calm effort pai internet 500 euros achet felicit;1
tout est complique  trop de demarches a faire  trop de papiers    j ai ete oblige a plusieurs reprises de telephoner pour me guider a l ecran  j ai fait selon ma conscience  et maintenant on me dit que j ai trop percu  je suis benevole dans une association  j ai bien declare les heures effectuees et on me dit qu il y a des erreurs ;1;['demarch', 'guid', 'ecran', 'selon', 'conscienc', 'benevol', 'associ', 'declar'];demarch guid ecran selon conscienc benevol associ declar;-1
je suis insatisfaite du traitement de mon dossier de demandeur d emploi par l agence pole emploi de capesterre belle eau de l ile de guadeloupe  les conseillers pole emploi qui m ont ete attribue ne facilite pas mon retour a l emploi  leur attitude professionnelle va contre mes interets de demandeur d emploi  les formalites n ont pas ete correctement rempli ;1;['insatisfait', 'dossi', 'agenc', 'capesterr', 'eau', 'ile', 'guadeloup', 'attribu', 'attitud', 'interet', 'formalit'];insatisfait dossi agenc capesterr eau ile guadeloup attribu attitud interet formalit;-1
j ai appele ce jour les services de pole emploi  par telephone au 3949  pour poser une question simple   ai je le droit aux indemnites si je pars vivre a l etranger   hors europe  pour y suivre mon conjoint    l interlocuteur commence par me dire que non  je n ai droit a rien  heureusement pour moi  j ai fait quelques recherches sur le sujet au prealable que je lui partage  j ai le droit a des indemnites une fois que je rentre en france     mon interlocuteur    tres desagreable  visiblement tres presse de se rendre a sa reunion  me met en attente pour verifier mes propos  il m explique ensuite qu effectivement  j ai des droits  j essaye de lui expliquer ma situation en details pour recolter le plus d informations precises mais il est tellement presse qu il ne prend pas la peine de m ecouter  me coupe sans arret la parole et me dit sur un ton tres vehement qu il est pourtant tres clair et ne voit pas comment mieux clarifier son propos  quand j essaye de lui demander de me rediriger vers quelqu un qui aurait plus de temps a me consacrer  et j entends egalement   plus de pedagogie   ou le service dedie a ce genre de situation exceptionnelle  il me repond que ce n est pas la peine  que personne n a le temps avant de me raccrocher au nez sans le moindre etat d ame ou formule de politesse  qui aurait pourtant ete bienvenue    j avise donc les services concernes a mieux renseigner les agents qui repondent aux appels telephoniques  mais egalement a mieux les eduquer sur les solutions qui existent  le systeme d indemnites n est pas simple a comprendre ;1;['servic', '3949', 'pos', 'indemnit', 'par', 'etrang', 'hor', 'europ', 'conjoint', 'interlocuteur', 'prealabl', 'partag', 'indemnit', 'interlocuteur', 'visibl', 'press', 'effect', 'recolt', 'press', 'coup', 'parol', 'veh', 'voit', 'clarifi', 'redirig', 'consacr', 'entend', 'pedagog', 'servic', 'ded', 'exceptionnel', 'person', 'raccroch', 'nez', 'ame', 'politess', 'bienvenu', 'avis', 'servic', 'agent', 'repondent', 'eduqu', 'solut', 'existent', 'system', 'indemnit'];servic 3949 pos indemnit par etrang hor europ conjoint interlocuteur prealabl partag indemnit interlocuteur visibl press effect recolt press coup parol veh voit clarifi redirig consacr entend pedagog servic ded exceptionnel person raccroch nez ame politess bienvenu avis servic agent repondent eduqu solut existent system indemnit;1
bonjour   j ai travaille en interim et j ai termine ma mission en octobre 2021  la boite d interim a mis ma prime de precarite dans un compte epargne cet et sur ma fiche de paye est bien precise  j ai demande le deblocage de cette somme et le pole emploi me demande un trop percu pour le mois de novembre 2021  alors que je n avait pas travaille  j ai demande a l entreprise d interim de me fournir une autre attestation  cette derniere a ete refuse par le pole emploi qui ne cherche pas a comprendre meme avec un mail expliquant bien la situation et precisant que la prime de precarite n ai pas considerer comme activite salariale  en plus de cela  je n ai pas ete paye par pole emploi pour le mois de mai 2022 alors que je n ai pas travaille    pouviez vous debloquer cette situation svp    merci d avance   cordialement ;1;['interim', 'interim', 'precarit', 'compt', 'epargn', 'pay', 'deblocag', 'somm', 'interim', 'attest', 'precarit', 'salarial', 'pay', 'debloqu', 'svp'];interim interim precarit compt epargn pay deblocag somm interim attest precarit salarial pay debloqu svp;2
je suis actuellement une formation pendant 3 ans dans le cadre d une reconversion professionnelle  je suis inscrite a pole emploi  pendant les periodes de formation  septembre a juin   je suis dans la categorie 4 des demandeurs d emploi  cette categorie expire le lendemain de la fin de ma formation pour l annee en cours  et je suis automatiquement desinscrite de pole emploi  je dois alors me reinscrire  puis m actualiser  ce qui retarde mon indemnisation et me cree une charge administrative supplementaire   c est egalement le cas d environ la moitie de ma promotion  nous devrons repeter cette procedure a chaque fin d annee  sachant que nous devons deja prevenir nos conseillers tous les ans de notre nouvelle entree en formation en septembre   cette procedure pourrait etre simplifiee en rebasculant automatiquement les personnes dans la categorie des demandeurs d emploi disponibles pour travailler  cela eviterait des oublis  des retards pour les demandeurs d emploi et beaucoup de travail pour les conseillers pole emploi qui doivent gerer ces dossiers et repondre aux questions inevitables des demandeurs d emploi dans cette situation ;1;['format', 'reconvers', 'inscrit', 'format', 'juin', 'categor', 'categor', 'expir', 'lendemain', 'format', 'desinscrit', 'reinscrir', 'retard', 'indemnis', 'administr', 'supplementair', 'moit', 'promot', 'devron', 'repet', 'procedur', 'devon', 'preven', 'entre', 'format', 'procedur', 'simplifie', 'rebascul', 'person', 'categor', 'disponibl', 'retard', 'dossi', 'inevit'];format reconvers inscrit format juin categor categor expir lendemain format desinscrit reinscrir retard indemnis administr supplementair moit promot devron repet procedur devon preven entre format procedur simplifie rebascul person categor disponibl retard dossi inevit;0
inscrite a pole emploi  j ai estime que mes allocation are  retour a l emploi  etaient bien faibles compte tenu du salaire que j avais  j ai demande a plusieurs reprise via l onglet reclamation de verifier ces droits  les appels telephoniques comme les messages via mon espace aboutissent a des reponses constamment differentes dont celle que tout etait normal  il s avere au final  et apres avoir insiste par de multiples reclamations  que mes droits etaient effectivement errones a hauteur de presque 300   des excuse du responsable indemnisation etc   on m a informe que les indemnites etaient calculees sur la base de l attestation pole emploi employeur et sans compte des indemnites de maladies et des eventuelles fiches de paye et que seule une reclamation declenche l etude exacte des droits   cela est gravissime car si je suis au fait des defaillances possibles et que je connais les rouage administratif  les personnes qui ne sont pas aussi averties et qui s en tiennent aux reponses apportes lors de mes premieres reclamations se voient spoliees de leurs veritables indemnites    je constate enormement de dysfonctionnements depuis mon inscription tout comme un manque d ergonomie et d acces sur le site   selection d envoi de type de documents limite  pas de prise de rendez vous en ligne pourtant oriente par la voix off lors des appels  le service indemnisation est le seul interlocuteur possible lors des transferts  ce sont des agents d accueils qui repondent sans aucun acces aux dossiers  il serait pourtant simple pour moi de changer ces dysfonctionnements les plus recurrents et faciliter la vie de millions de personnes mais egalement des agents  je suis surtout choque par les indemnites qui ne doivent pas etre reclamees faute d informations ;1;['inscrit', 'estim', 'alloc', 'faibl', 'compt', 'tenu', 'salair', 'onglet', 'reclam', 'about', 'repons', 'const', 'aver', 'insist', 'reclam', 'effect', 'erron', 'hauteur', '300', 'respons', 'indemnis', 'indemnit', 'calcule', 'attest', 'employeur', 'compt', 'indemnit', 'malad', 'eventuel', 'pay', 'reclam', 'declench', 'etud', 'exact', 'gravissim', 'defaill', 'possibl', 'rouag', 'administr', 'person', 'avert', 'tiennent', 'repons', 'apport', 'premier', 'reclam', 'voient', 'spolie', 'indemnit', 'ergonom', 'select', 'docu', 'orient', 'voix', 'off', 'servic', 'indemnis', 'interlocuteur', 'transfert', 'agent', 'repondent', 'dossi', 'recurrent', 'million', 'person', 'agent', 'choqu', 'indemnit', 'reclame'];inscrit estim alloc faibl compt tenu salair onglet reclam about repons const aver insist reclam effect erron hauteur 300 respons indemnis indemnit calcule attest employeur compt indemnit malad eventuel pay reclam declench etud exact gravissim defaill possibl rouag administr person avert tiennent repons apport premier reclam voient spolie indemnit ergonom select docu orient voix off servic indemnis interlocuteur transfert agent repondent dossi recurrent million person agent choqu indemnit reclame;-1
j ai demande a participer a un evenement pole emploi  les conseillers que j ai eu au numero de service 3949 non pas voulu me renseigner  ils ont dit que cette evenement d acces a l emploi faisait l objet d une pre selection pour acceder a la recherche d emploi  le pole emploi n a pas souhaite me communiquer les moyens d acceder a l evenement  le rally pour l emploi  du 28 juin 2022;1;['even', 'servic', '3949', 'even', 'objet', 'select', 'communiqu', 'even', 'rally', 'juin'];even servic 3949 even objet select communiqu even rally juin;-1
