Description;e-mail;Description_2;Description_3;clusters
la demarche de recherche est tres intuitive et beaucoup de filtres sont proposes  les offres proposees sont tres detaillees   possibilite d envoyer les offres sur sa boite mail   petit bemol   sur ce site les agences d interims proposent plusieurs annonces pour un seul poste  cela fait perdre du temps ;1;['demarch', 'intuit', 'filtr', 'offre', 'propose', 'detaille', 'offre', 'bemol', 'agenc', 'interim', 'proposent'];demarch intuit filtr offre propose detaille offre bemol agenc interim proposent;-1
je souhaite suivre une formation l annee prochaine et je sais qu il existe une aide de pole emploi specifique pour mon cas puisque le lieu de cette formation va m obliger a demenager mais je ne parviens pas a obtenir d information claire et nette de la part de pole emploi   pour l instant la situation n est pas tres urgente car la formation ne debutera que dans plusieurs mois mais je suis inquiet du fait qu une administration qui est censee exister pour m aider ne daigne pas m apporter de reponse   on s etonnera ensuite que de nombreux demandeurs d emploi se decouragent   ;1;['format', 'specif', 'format', 'demenag', 'parvien', 'net', 'instant', 'urgent', 'format', 'debut', 'inquiet', 'administr', 'cense', 'daign', 'apport', 'repons', 'eton', 'decouragent'];format specif format demenag parvien net instant urgent format debut inquiet administr cense daign apport repons eton decouragent;1
au debut avec pole emploi  j ai eus une conseillere tres agreable puis je suis passee a une autre conseillere et encore une autre avec qui j avais un peu de mal dans la communication ex   un jour  nous faisons un entretien telephonique et a un moment je ne l entends pas bien et meme presque pas je lui dis alors  et elle me lance   et la je m  excuse aupres d elle d un ton honteux et l entretien se termine comme ca  quand j  ai recu l enquete de satisfaction j ai demander a changer de conseillere  et rapidement on m informait qu il m  avait ete attribuer une nouvelle conseillere  jusqu a maintenant  je me sens bien avec celle ci qui prend son temps et qui se tient au fait de ma situation en temps voulu sauf que dernierement un tout petit incident pas tres grave est intervenu  je m  explique  j avais un contrat de travail et je lui ai informer de mon changement de situation  nous avons fait l  entretien telephonique  j ai recu la synthese d  entretien sauf que j avais stipuler contrat de 1 ans et elle a inscrit 2 ans  j  ai lui ai envoyer un mail pour l en informer et elle m a reecrit oui mais ce genre de contrat peut etre reconduit 1 an de plus  c  est pour cela que j ai mis 2 ans  j ai quand meme demander rectification pour etre en regle et elle m a renvoyer une nouvelle synthese d entretien breve avec juste 4 lignes  j ai sentis dans cette synthese que je l avais agacer mais au moins j avais obtenu satisfaction et l esprit tranquille  avec tout cela  j en ai deduis que des personnes peuvent etre fragilisees par la facon dont les conseillers leur parle et avoir un sentiment de rabaissement et de ne plus avoir envie de se rendre dans les locaux de pole emploi par manque d estime de soi ;1;['passe', 'ex', 'faison', 'entend', 'lanc', 'enquet', 'satisfact', 'attribu', 'tient', 'dernier', 'incident', 'grav', 'intervenu', 'contrat', 'synthes', 'stipul', 'contrat', 'inscrit', 'reecr', 'contrat', 'reconduit', 'rectif', 'renvoi', 'synthes', 'brev', 'synthes', 'agac', 'obtenu', 'satisfact', 'esprit', 'tranquill', 'deduis', 'person', 'fragilise', 'rabaissement', 'estim', 'soi'];passe ex faison entend lanc enquet satisfact attribu tient dernier incident grav intervenu contrat synthes stipul contrat inscrit reecr contrat reconduit rectif renvoi synthes brev synthes agac obtenu satisfact esprit tranquill deduis person fragilise rabaissement estim soi;2
1er entretien le 06 09  je recois les coordonnees de mon conseiller  plus tard  je veux envoyer la fiche de paie quand j ai travaille en aout   sur mon compte  je peux la mettre en pj  mais la validation ne passe pas  j envoie un mail a mon conseiller   le mail me revient car adresse mail invalide      elle m avait aussi indique d appeler le 3949 lorsque nous demenagerions en dordogne  pour transferer mon dossier  j appelle le 3949  mais la boite vocale ne me permet pas d acceder a un interlocuteur pour modifier mon adresse  en conclusion  on ne peut pas joindre pole emploi par mail  ni par telephone   adresse mail du conseiller qui n aboutit pas   au telephone  pas d option possible pour parler a quelq un   pas d adresse mail generale a pole emploi  donc  j ai change d adresse  de departement  je fais quoi   service impossible a joindre directement ;1;['06', '09', 'pai', 'compt', 'pj', 'revient', 'invalid', 'appel', '3949', 'demenag', 'dordogn', 'transfer', 'dossi', 'appel', '3949', 'vocal', 'interlocuteur', 'conclus', 'about', 'option', 'quelq', 'general', 'servic'];06 09 pai compt pj revient invalid appel 3949 demenag dordogn transfer dossi appel 3949 vocal interlocuteur conclus about option quelq general servic;2
indemnise a hauteur de 12  par jour soit 320  mois pendant 500 jours   quelle inutilite  ne serait il pas plus judicieux d indemniser plus  mais moins longtemps   evidemment    un demandeur d emploi a d abord besoin de protection  voire de temps pour se former    egalement scandaleux  quand il y a une erreur  soit de la part du demandeur  soit de la part de  pole emploi  c est toujours le demandeur qui trinque   on est prive pendant un mois d indemnisation  et en plus on est somme de rembourser les soi disant trop percus    quel est le projet   un retour digne a l emploi   ou une precarisation a l extreme des demandeurs pour qu ils soient pret a accepter n importe quoi  ;1;['indemnis', 'hauteur', '320', '500', 'inutilit', 'judici', 'indemnis', 'longtemp', 'abord', 'protect', 'scandal', 'trinqu', 'indemnis', 'somm', 'rembours', 'soi', 'percus', 'dign', 'precaris', 'extrem', 'pret'];indemnis hauteur 320 500 inutilit judici indemnis longtemp abord protect scandal trinqu indemnis somm rembours soi percus dign precaris extrem pret;-1
je suis intermittente du spectacle depuis 2014  je dois donc m actualiser tous les mois  j ai oublie de le faire pour la premiere fois en 9 ans pour le mois de septembre  pole emploi spectacle  4h d essai avant d arriver a les joindre  ne peut pas m aider  mais me precise que je ne toucherai pas mes indemnites pour septembre  mon seul revenu donc   la conseillere est tres desagreable  on m envoie vers le service inscription  qui ne peut pas m aider  en insistant  la conseillere tres desagreable egalement  me dit que peut etre je peux tenter de demander une inscription retroactive a l agence pole emploi la plus proche  en faisant un courrier en recommande  mais ne peut pas m en dire plus  elle m envoie vers le service indemnite  apres 1h15 d attente je n en pouvais plus  j ai raccroche  un mois d indemnite  c est cher paye pour un malheureux oubli ;1;['intermittent', '2014', '9', '4h', 'indemnit', 'servic', 'insist', 'tent', 'retroact', 'agenc', 'courri', 'recommand', 'servic', 'indemnit', '1h15', 'raccroch', 'indemnit', 'cher', 'pay'];intermittent 2014 9 4h indemnit servic insist tent retroact agenc courri recommand servic indemnit 1h15 raccroch indemnit cher pay;-1
j ai demenage  enfin je suis retourne chez mes parents et je n ai pas eu de rsa entre le gard et le jura  j ai un traitement medical et je n ai pas pu me soigner  dentiste   je n ai pas pu demenager mon studio  j ai perdu mon velo  scooter  voiture  ordinateur  photos  bijoux  vetements   tout  pole emploi et les assistantes sociales ne me donnaient pas de rdv  j ai du les intimider par courrier  aujourd hui j ai des dettes et meme le mediateur ne m aide pas ;1;['demenag', 'rsa', 'gard', 'jur', 'medical', 'soign', 'dentist', 'demenag', 'studio', 'velo', 'scoot', 'voitur', 'photos', 'bijoux', 'vet', 'rdv', 'intimid', 'courri', 'det', 'mediateur'];demenag rsa gard jur medical soign dentist demenag studio velo scoot voitur photos bijoux vet rdv intimid courri det mediateur;2
peu de delai d attente  par contre dans un espace peu adapte a la confidentialite  bon accueil initial  et professionnalisme  dans la pedagogie egalement  proposition totale des servives a rendre  politesse et amabilite   conseillere indemnisation  reactivite aux envois de courriers  point d amelioration   bureau ferme ;1;['confidentialit', 'initial', 'professionnal', 'pedagog', 'total', 'serviv', 'politess', 'amabilit', 'indemnis', 'reactivit', 'envois', 'courri', 'bureau', 'ferm'];confidentialit initial professionnal pedagog total serviv politess amabilit indemnis reactivit envois courri bureau ferm;-1
j ai repondu a une offre d emploi de couturiere pour un remplacement de 2 mois  l entreprise debute toujours par une periode de stage de 15 jours  dans mon cas c etait 4 jours car je suis qualifiee avec 14 ans d experience  a l issue du stage on m annonce qu  ils ne peuvent pas me proposer de contrat car l entreprise a perdu un marche   4 jours plus tard  une autre stagiaire occupe mon poste  cherchez l erreur   l entreprise recrute essentiellement des personnes en situation de handicap    pole emploi fait des conventions de stage a tour de bras sans aucun controle ;1;['offre', 'couturier', 'remplac', 'debut', 'qualifie', '14', 'issu', 'contrat', 'stagiair', 'occup', 'cherch', 'essentiel', 'person', 'handicap', 'convent', 'tour', 'bras'];offre couturier remplac debut qualifie 14 issu contrat stagiair occup cherch essentiel person handicap convent tour bras;2
inscrite depuis peu a pole emploi  j ai recu une notification de decision suite a mon inscription  j ai acquis des droits je m actualise donc tous les mois  mes jours acquis sont bien decomptes mais ne me sont pas regles  je suis en communication toutes les semaines avec mon conseille financier par mail ainsi qu avec d autre conseillers pole emploi par telephone afin de regler le probleme mais mes indemnites  sont toujours bloquees ce jour 97 jours d indemnites mon ete decompte sans reglement aucun  je me retrouve dans une situation financiere tres compliquee depuis plus de 3 mois et je n en vois pas la fin;1;['inscrit', 'decis', 'acquis', 'acquis', 'decompt', 'financi', 'indemnit', 'bloque', '97', 'indemnit', 'decompt', 'complique', 'vois'];inscrit decis acquis acquis decompt financi indemnit bloque 97 indemnit decompt complique vois;-1
j ai fait ma declaration le 30 du mois en anticipant mon salaire brut  lorsque j enverrai ma fiche de salaire  une regularisation sera effectuee vers le 10 du mois  donc  pas de panique  meme si vous anticipez  pole emploi fait le calcul quelques jours apres et fera le necessaire des la reception de votre feuille de paie ;1;['declar', 'anticip', 'salair', 'enverr', 'salair', 'effectue', 'paniqu', 'anticip', 'pai'];declar anticip salair enverr salair effectue paniqu anticip pai;0
je suis suivit depuis 2017 par cap emploi  mon principal frein est mon handicap   sauf qu ils s agit d un handicap non visible donc pour beaucoup de conseillers je ne suis pas handicape   entre aout et novembre je n ai pas eu de conseiller cap emploi  j ai du me tourner vers accelr emploi qui n est pas adapte a ma situation  le handicap n est pas pris en compte et en plus comme il n y avait pas assez de personnes sur le site  on nous a envoyer vers un autre site inadapte a mon handicap j ai ete oblige de suivre la prestation en visio et ce n etait pas du tout adapte    normalement j aurai du beneficier de la prestation includ pro insertion de l agefiph mais comme je n avait pas de conseiller en septembre je n ai pas pu avoir de place maintenant que j ai un conseiller  il n y a plus de places disponibles ;1;['2017', 'cap', 'frein', 'handicap', 'agit', 'handicap', 'visibl', 'handicap', 'cap', 'accelr', 'handicap', 'compt', 'person', 'inadapt', 'handicap', 'visio', 'includ', 'pro', 'insert', 'agefiph', 'plac', 'disponibl'];2017 cap frein handicap agit handicap visibl handicap cap accelr handicap compt person inadapt handicap visio includ pro insert agefiph plac disponibl;-1
j ai ete licencie pour inaptitude professionnel apres 40 ans a travaille dans le batiment carreleur  je me suis inscrit a pole emploi  aucun rdv  demande de document permanent alors que mon employeur a fait le necessaire  j ai appele pour savoir si c etait possible de rencontrer ma referente   donne d office  on me dit que non un rdv telephonique uniquement pour l instant  inscrit depuis le 11 octobre et je ne sais toujours pas combien je vais etre remunere  les offres d emploi sont toujours les memes   a 58 ans j aimerais me reconvertir dans le service a domicile  pour faire des stages il faut attendre des mois     je me sent pas du tout aide pour pouvoir rebondir   j ai toujours travaille et j ai encore envi de continuer  on nous dit qu il y a du travail dans plein de secteur mais on est mal accompagne  c est deshumanisant  je ne demande qu a etre accompagne pour me reinserer  c est long;1;['licenc', 'inaptitud', '40', 'carreleur', 'inscrit', 'rdv', 'docu', 'permanent', 'employeur', 'appel', 'offic', 'rdv', 'instant', 'inscrit', '11', 'combien', 'remuner', 'offre', '58', 'reconvert', 'servic', 'rebond', 'deshumanis', 'reinser'];licenc inaptitud 40 carreleur inscrit rdv docu permanent employeur appel offic rdv instant inscrit 11 combien remuner offre 58 reconvert servic rebond deshumanis reinser;-1
depuis debut octobre  j ecris a ma conseillere et mon conseiller indemnisation mais mes demandes de rendez vous  telephoniques ou physique ne recoivent pas la moindre reponse  je suis toujours reste courtois et je veux que pole emploi me communique les information sur des periodes d indemnisation durant ma carriere afin de valider mon dossier de demande de retraite mais les mails sont classes   poubelle   sans la moindre reponse  j ai recu un email qui me disait que la situation etait regularisee   mais rien n a ete fait  du reste je ne sais pas comment ils auraient pu regulariser puisqu ils ne connaissaient pas les periodes en cause   lors d une reunion generale  debut octobre  personne n a voulu m ecouter  ils ont refuse toutes demandes d infos personelles  un rdv m a ete donne  telephoniquement avec ma conseillere  et c est une autre personne qui m a repondue  me disant incompetente a repondre a mes questions  ma caisse de retraite me demande ces documents  mais personne de pole emploi ne reponds a mes emails  je trouve hallucinant que de simples demandes de justificatifs ne soient pas traites par les conseillers de pole emploi ;1;['ecris', 'indemnis', 'recoivent', 'repons', 'courtois', 'indemnis', 'dossi', 'retrait', 'class', 'poubel', 'repons', 'regularise', 'puisqu', 'general', 'person', 'infos', 'personel', 'rdv', 'person', 'incompetent', 'caiss', 'retrait', 'docu', 'person', 'hallucin', 'simpl', 'justif'];ecris indemnis recoivent repons courtois indemnis dossi retrait class poubel repons regularise puisqu general person infos personel rdv person incompetent caiss retrait docu person hallucin simpl justif;-1
premier rendez vous a pole mploi lagarde  un peu d apprehension au depart  une conseillere a pris le temps de m expliquer simplement tous les rudiments de base du site et la future marche a suivre  je tiens a signaler que cette personne a ete tres performante  je ne suis pas encore sauve mais deja rassure ;1;['mploi', 'lagard', 'apprehens', 'rud', 'futur', 'person', 'perform', 'sauv', 'rassur'];mploi lagard apprehens rud futur person perform sauv rassur;2
    c est le service a contacter  malheureusement  il s agit d un passage oblige lorsque l on est demandeur d emploi   pole emploi  c est la deshumanisation du marche du travail  lorsque vous allez en agence  l accueil est assure par une tablette et lorsque l on echange avec un  conseiller  il se comporte en robot   peu leur importe que vous soyez actif dans votre recherche d emploi ou votre reconversion  il ne faut surtout pas leur prendre trop de temps    si votre mail fait plus de 4 lignes   il n est pas lu integralement  si vous n entrez pas dans le moule   vous etes une gene   lors de mon inscription  je leur indique que je suis dans une demarche de creation d entreprise donc la semaine suivante je recois un coup de telephone d un prestataire prive  certainement paye a prix d or  pour mes demarches    de retour a un emploi salarie   je ne prendrai qu un exemple mais malheureusement  il ne s agit pas d un evenement isole mais bien d une constante dans mon experience aupres de ce service ;1;['servic', 'contact', 'agit', 'passag', 'deshumanis', 'agenc', 'assur', 'tablet', 'robot', 'actif', 'reconvers', 'lu', 'integral', 'entrez', 'moul', 'demarch', 'prestatair', 'pay', 'prix', 'demarch', 'prendr', 'agit', 'even', 'isol', 'const', 'servic'];servic contact agit passag deshumanis agenc assur tablet robot actif reconvers lu integral entrez moul demarch prestatair pay prix demarch prendr agit even isol const servic;-1
j ai 54 ans et   c est ma 1ere experience avec pole emploi  certains diront   quelle chance   la ou d autres diront   pas de chance    en a peine quelques jours  dans le cadre d un csp  j ai percu tout ce qui ne va pas  qui pourrait etre ameliore car ameliorable pour une meilleure qualite de service a la fois pour l usager et pour les employes  cette amelioration se resume en deux mots   moins d administratif   et   plus d ecoute  de bienveillance     j ai vu en direct dans deux agences  des usagers reduits a l etat de dindon sans tete a qui on parle en infantilisant et que l on balade d un centre a l autre ou en insistant sur l espace particulier  la demarche tout numerique a quelqu un  qui  fragile  vulnerable ne semblait rien comprendre mais n osait pas l indiquer  des problemes de courrier  d adresse postale  numerique et puis des dates de declaration depassees  un labyrinthe administratif  la zizanie vue par uderzo  l impression aussi que le personnel suit d abord et avant tout un protocole purement administratif  donc  pourquoi ne pas l alimenter en redemandant des documents supplementaires  complementaires avec des justificatifs anciens  ca occupera l usager sans doute  deprimant  usant  fatigant  stressant  on a parfois besoin  dans une vie compliquee a toutes les etapes  d une veritable ecoute  d une aide qui finalise un dossier  de la bienveillance  demandez sans cesse des complements administratifs releve de l acharnement voire meme de la maltraitance administrative  j ai senti la faille entre un public qui travaille et un public qui  en attente d un emploi ou d un revenu meme minime  est aussi en attente d une legerete  d un soutien moral  d un personnel aidant  bref d une rehumanisation de la societe  j ai senti aussi que j en avais besoin ;1;['54', '1er', 'diront', 'diront', 'csp', 'meilleur', 'servic', 'usag', 'resum', 'administr', 'agenc', 'usager', 'reduit', 'dindon', 'tet', 'infantilis', 'balad', 'insist', 'demarch', 'numer', 'fragil', 'vulner', 'sembl', 'osait', 'courri', 'postal', 'numer', 'declar', 'depasse', 'labyrinth', 'administr', 'zizan', 'uderzo', 'impress', 'personnel', 'suit', 'abord', 'protocol', 'pur', 'administr', 'aliment', 'redemand', 'docu', 'supplementair', 'complementair', 'justif', 'occup', 'usag', 'deprim', 'usant', 'fatig', 'stress', 'complique', 'etap', 'dossi', 'cess', 'compl', 'administr', 'acharn', 'maltrait', 'administr', 'faill', 'minim', 'legeret', 'soutien', 'moral', 'personnel', 'rehumanis'];54 1er diront diront csp meilleur servic usag resum administr agenc usager reduit dindon tet infantilis balad insist demarch numer fragil vulner sembl osait courri postal numer declar depasse labyrinth administr zizan uderzo impress personnel suit abord protocol pur administr aliment redemand docu supplementair complementair justif occup usag deprim usant fatig stress complique etap dossi cess compl administr acharn maltrait administr faill minim legeret soutien moral personnel rehumanis;2
j ai depose une convention de stage il y a deux semaines   aujourd hui  jour de debut de stage  les documents ne sont toujours pas parvenus ni a moi  ni a mon employeur  je ne suis donc pas couvert et le stage ne peut pas commencer  joli debut pour pole emploi  contrarier un projet de retour a l emploi    et vous vous etonnez que les gens preferent rester au chomage plutot  que de travailler   ;1;['convent', 'docu', 'parvenus', 'employeur', 'couvert', 'jol', 'contrari', 'eton', 'preferent', 'chomag'];convent docu parvenus employeur couvert jol contrari eton preferent chomag;-1
bonjour je suis maintenant en ass depuis 5 ans de chomage  je me bats pour reconquerir le marche du travail  ayant ete cassee dans ma carriere  a 52 ans passes  je me suis presentee et inscrite a une reunion d information au lycee etienne legrand afin de parfaire mes competences et valider mes remplacements par un diplome d etat  lors de la reunion au greta avec pole emploi  on a refuse ma candidature pour demarrer cette formation sans motif  je vous demande d intervenir au plus vite  je n accepte pas une fois de plus la decision de pole emploi  de plus je candidate et une fois sur deux   l offre est cloturee  ;1;['ass', 'chomag', 'reconquer', 'casse', '52', 'presente', 'inscrit', 'lyce', 'etien', 'legrand', 'parfair', 'remplac', 'gret', 'demarr', 'format', 'interven', 'decis', 'offre', 'cloture'];ass chomag reconquer casse 52 presente inscrit lyce etien legrand parfair remplac gret demarr format interven decis offre cloture;1
excellente interface mise a jour   toutefois  juste une petite remarque  on aimerait juste pouvoir connaitre la suite du processus avant de cliquer sur suivant   mais tres bien   tres positif  ne changez pas tout le temps d ergonomie svp     ;1;['excellent', 'interfac', 'toutefois', 'remarqu', 'connaitr', 'processus', 'chang', 'ergonom', 'svp'];excellent interfac toutefois remarqu connaitr processus chang ergonom svp;-1
lors du dernier confinement et apres un bilan de competences j ai choisi de m orienter vers le metier de l evolution professionnelle  a l issu de la formation de huit mois dont j ai obtenu un titre reconnu au niveau 5 du rncp  j ai passe les epreuves de test de selection chez pole emploi  que j ai reussi  j ai passe plusieurs entretiens en viso avec les rh  mais je n ai eu le droit qu a de la mefiance  ce qui est encore plus grave c est qu etant au rsa je suis cense etre suivi regulierement par pole emploi hors ca fait plus de trois mois que pole emploi est cense me contacter et que rien n est fait dans ce sens si ca continue j envoie un courrier au president de la republique ;1;['confin', 'orient', 'evolu', 'issu', 'format', 'huit', 'obtenu', 'reconnu', 'rncp', 'epreuv', 'test', 'select', 'viso', 'rh', 'mefianc', 'grav', 'rsa', 'regulier', 'hor', 'contact', 'courri', 'president', 'republ'];confin orient evolu issu format huit obtenu reconnu rncp epreuv test select viso rh mefianc grav rsa regulier hor contact courri president republ;-1
mes revenus pole emploi sont variables en fonction des saisies sur salaires  de plus je viens de reprendre une activite en interim remuneree moins importante que mon chomage  ;1;['revenus', 'variabl', 'salair', 'interim', 'remunere', 'chomag'];revenus variabl salair interim remunere chomag;0
suite a une demande d allocations chomage qui a ete refusee alors qu a priori je remplie toutes les conditions pour obtenir l are  j ai envoye plusieurs emails a la personne indiquee comme ma conseillere indemnisation afin d obtenir une explication  apres chacun de mes emails  envoyes a plus de 3 jours d intervalle  j ai bien recu l email automatique de pole emploi indiquant que mon message avait bien ete recu et que j obtiendrais une reponse dans les 48h  je n ai jamais eu aucune reponse a mes demandes et ai finalement du me rendre en agence ;1;['alloc', 'chomag', 'prior', 'condit', 'person', 'indique', 'indemnis', 'intervall', 'obtiendr', 'repons', '48h', 'repons', 'agenc'];alloc chomag prior condit person indique indemnis intervall obtiendr repons 48h repons agenc;-1
