Description;e-mail;Description_2;Description_3;clusters
42 ans  2 enfants en bas age  infirmiere en cours de separation   travaille au meme endroit que mon ex mari  je me fais licencier apres quelques mois sans solde  et une erreur de date de reprise de mon employeur     resultat  je me retrouve avec quasi rien  garde alternee  route sainte anne  baie mahaut pour l ecole 4 fois par jour   mon ex mari est devenu un mur et en colere  1ere rencontre avec pole emploi de saint francois   wouah en pleur  je me presente et a ma grande surprise j ai ete accueillie avec beaucoup de bienveillance et d ecoute et surtout une reactivite envers mon dossier et les droit   un grand merci pour m avoir fait respirer un peu  puis apres j ai a faire a ma conseillere qui est une personne vraiment sympathique avec qui je me suis sentie tout de suite a l aise   nous faisons le point  puis  de mon cote je cherche des alternative de travail  ne pouvant plus exercer ce metier pour cause d horaires decales   je suis seule en guadeloupe sans famille pour m epauler  je suis quemqu un qui ne lache rien  cortiquee  et malgre le fait que tout le personnel a vraiment ete bienveillant  empathique et reactif envers mes dossiers nombreux tel d aide sociale  je me trouve desormais devant le fait que si je n arrive pas avec des questions reponses    il ne se passe rien    fouille internet de ma part et je suis decue du systeme qui fait que pour mon cas j aurais pu beneficier de l aide de l adie avec un super projet  rdv pris papier ok etc  mais la il  manque un garant obligatoire et la la colere l incomprehension je n en ai pas  pas de famille et les proches ont peur a cause de la vie d aujourd hui   bref tous mes espoirs sont tombes a l eau  je suis en mode survie avec une voiture qui va bientot casser  pas d aide    avec une aide  de la croix rouge pour me nourrir ainsi que mes enfants    j arrive a la fin     pas d aide pour le transport routier  essence etc  pas d aide pour faire des photocopies tout simplement  j en suis au point ou je n ai plus de liquide sur moi carte bloquee et loyer pas paye  ah noel approche;1;['42', 'infirmier', 'separ', 'endroit', 'ex', 'licenci', 'sold', 'employeur', 'quas', 'gard', 'alterne', 'rout', 'saint', 'bai', 'mahaut', 'ecol', 'ex', 'mur', 'coler', '1er', 'saint', 'francois', 'wouah', 'pleur', 'reactivit', 'enver', 'dossi', 'respir', 'person', 'sympath', 'ais', 'faison', 'altern', 'exerc', 'horair', 'decal', 'guadeloup', 'famill', 'epaul', 'quemqu', 'lach', 'cortique', 'personnel', 'empath', 'reactif', 'enver', 'dossi', 'tel', 'repons', 'fouill', 'internet', 'system', 'adi', 'rdv', 'ok', 'coler', 'incomprehens', 'famill', 'peur', 'espoir', 'tomb', 'eau', 'mod', 'surv', 'voitur', 'bientot', 'cass', 'croix', 'roug', 'nourr', 'transport', 'routi', 'essenc', 'photocop', 'liquid', 'bloque', 'pay', 'ah', 'noel', 'approch'];42 infirmier separ endroit ex licenci sold employeur quas gard alterne rout saint bai mahaut ecol ex mur coler 1er saint francois wouah pleur reactivit enver dossi respir person sympath ais faison altern exerc horair decal guadeloup famill epaul quemqu lach cortique personnel empath reactif enver dossi tel repons fouill internet system adi rdv ok coler incomprehens famill peur espoir tomb eau mod surv voitur bientot cass croix roug nourr transport routi essenc photocop liquid bloque pay ah noel approch;-1
comme je suis orientee vers cap emploi car handie je n ai pas d aide d un conseiller pole emploi et ne peux pas changer de conseiller car un seul conseiller cap emploi  et il ne connait rien aux demarches  cela fait 6 mois qu il ne comprend pas les demarches et me donne des informations fausses ou exige de moi des actions que je ne peux pas faire par epuisement et handicap ou parce que n a pas de raison d etre et ne peut pas etre fait dans la situation  avec preuve a l appui  pour des demandes de financement  et il me redemande sans cesse les memes actions dont je lui explique ne pas pouvoir les faire   ensuite il s est trompe dans des demarches aupres de l agefiph ce qui a fait que je n ai pas eu de financements  il me dit avoir affirme des choses dont je sais que c est faux    je n ai pas recu l aif pour  refus d utiliser le cpf  alors que le compte cpf ne peut pas etre utilise pour ma formation et que normalement ca n empeche pas l aif de pouvoir etre utilisee  il m a fait signer des choses pour faire a ma place des choses  mais c est uniquement les actions ou j aurais voulu avoir du pouvoir decisionnel  notamment sur les descriptions de mes projets pour les demandes de financement et pour savoir ce qu il se passe  mais pour le reste il n est pas present  j ai depuis mai bataille pour des financements mais quand il m a dit de mettre un devis pour formation sur mon compte sans me dire de demander a l organisme de le mettre via kairos  il m a dit que ca allait de l envoyer en mettant le document dans n importe quelle case de document  et je viens  par moi meme de comprendre qu il ne fallait pas faire cela  et donc qu il ne m a pas indiquee comme en formation  mais j ai fait tout ce que j ai pu pour avoir des informations   c est un enfer  je n ai personne a qui parler  les personnes du 3949 ne peuvent pas aider  je suis dans une situatation surreelle dont mes aidants medico sociaux sont choques sur la violence institutionnelle et le deni de droits   c est un enfer ;1;['oriente', 'cap', 'hand', 'cap', 'demarch', 'demarch', 'epuis', 'handicap', 'appui', 'financ', 'redemand', 'cess', 'tromp', 'demarch', 'agefiph', 'financ', 'affirm', 'aif', 'cpf', 'compt', 'cpf', 'format', 'empech', 'aif', 'utilise', 'decisionnel', 'descript', 'financ', 'bataill', 'financ', 'format', 'compt', 'kairos', 'allait', 'docu', 'docu', 'indique', 'format', 'enfer', 'person', 'person', '3949', 'surreel', 'medico', 'choqu', 'violenc', 'institutionnel', 'den', 'enfer'];oriente cap hand cap demarch demarch epuis handicap appui financ redemand cess tromp demarch agefiph financ affirm aif cpf compt cpf format empech aif utilise decisionnel descript financ bataill financ format compt kairos allait docu docu indique format enfer person person 3949 surreel medico choqu violenc institutionnel den enfer;-1
bonjour  ne retrouvant pas de travail digne de ce nom au vue de mon age et de ma sante  j interviens occasionnellement chez des personnes  le hic est que le nouveau logiciel d actualisation de pole emploi estime que je travaille tous les mois pour ces gens la  afin de valider mon actualisation  je dois donc noter  que j ai travaille 1 heure pour 0   et contacter par mail la personne qui travaille au service indemnisation de l agence pole emploi locale  les allocations sont versees au milieu du mois suivant  le temps que tout soit verifie et debloque  pas facile quand on n a a peine 600   de revenus par mois et qu on vit seule ;1;['retrouv', 'dign', 'sant', 'intervien', 'occasionnel', 'person', 'hic', 'estim', 'contact', 'person', 'servic', 'indemnis', 'agenc', 'alloc', 'verse', 'milieu', 'verif', 'debloqu', '600', 'revenus'];retrouv dign sant intervien occasionnel person hic estim contact person servic indemnis agenc alloc verse milieu verif debloqu 600 revenus;0
etant handicape  je peut normalement beneficier de prestation agefiph  sauf que le delais pour en beneficier est tres long  j ai fait la demande en juin 2022 a mon conseiller cap emploi et normalement j integre la prestation en fevrier 2023   les delais pour une prescription equivalent a pole emploi est inferieur a 15 jours  hors ces prestations sont totalement inadapte au handicape ;1;['handicap', 'agefiph', 'juin', 'cap', 'integr', 'prescript', 'equivalent', 'inferieur', 'hor', 'inadapt', 'handicap'];handicap agefiph juin cap integr prescript equivalent inferieur hor inadapt handicap;-1
j ai travaille pour une societe qui dissimulait des travailleurs  la societe avait une combine pour ne payer que 2 3 du salaires des salaries  le reste etait comble par pole emploi  le salarie n etait declare que 50h par mois  ce qui permettait de conserver le chomage   en moyenne 10 salaries par ans dans l entreprise etaient sous ce statut  une fraude imposee aux salaries entrant dans l entreprise   pour l entreprise une economie substantielle a laquelle j ai participe bon gres mal gre en tant que salarie  par la case prud homme j ai fait requalifier mon poste et ainsi l employeur a du me verser mes salaires   a la suite de ca  j ai tente de denoncer la fraude a pole emploi  j avais un dossier de plusieurs centaines de pages demontrant la fraude  pour moi ainsi que pour les autres    un dossier en or pour pole emploi et l occasion de requalifier en cdi l ensemble des travailleurs pas voie de justice   qu a fait pole emploi   rien  j ai passe un an envoyer mon dossier a toutes les spheres de pole emploi  la partie fraude en premier  mais jamais pole emploi n a voulu de mes pieces   je me suis donc rendu a mon agence  leur expliquant la situation  ils ont d ailleurs pu confronter mes pieces avec leur base de donnees devant moi et oui la fraude apparaissait comme evidente   mon dossier a donc ete envoye au service fraude par mon agence pe     le service fraude a retourne la clefs usb avec tout le dossier a mon agence pe en leur disant qu ils ne pouvaient pas ouvrir de clefs usb pour des raisons de securite   voila  la societe n a jamais ete condamnee alors qu elle a fraude massivement mais pe est plus occupe a faire baisser artificiellement les chiffres du chomage   merci pe  ;1;['dissimul', 'travailleur', 'combin', 'pai', 'salair', 'combl', 'declar', '50h', 'conserv', 'chomag', 'moyen', 'fraud', 'impose', 'entrant', 'substantiel', 'gre', 'gre', 'prud', 'homm', 'requalifi', 'employeur', 'salair', 'denonc', 'fraud', 'dossi', 'centain', 'demontr', 'fraud', 'dossi', 'occas', 'requalifi', 'cdi', 'ensembl', 'travailleur', 'justic', 'dossi', 'spher', 'fraud', 'agenc', 'confront', 'fraud', 'apparaiss', 'dossi', 'servic', 'fraud', 'agenc', 'servic', 'fraud', 'clef', 'usb', 'dossi', 'agenc', 'clef', 'usb', 'raison', 'securit', 'condamne', 'fraud', 'massiv', 'occup', 'baiss', 'artificiel', 'chomag'];dissimul travailleur combin pai salair combl declar 50h conserv chomag moyen fraud impose entrant substantiel gre gre prud homm requalifi employeur salair denonc fraud dossi centain demontr fraud dossi occas requalifi cdi ensembl travailleur justic dossi spher fraud agenc confront fraud apparaiss dossi servic fraud agenc servic fraud clef usb dossi agenc clef usb raison securit condamne fraud massiv occup baiss artificiel chomag;0
depuis le mois d avril 2022 j ai sollicite plusieurs fois un rendez vous avec ma conseillere sans succes a la date actuelle   je lui ai envoye des mails  je suis allee a l agence pour demander le rendez vous personnellement  les agents m ont ecoute et m ont promis de lui passer ma solicitude    mais pas de rendez vous ni d appel telephonique de sa part  j ai le status rqth depuis octobre 2021  la personne responsable dans ma ville m a envoye a pole emploi solliciter un conseiller caf  la personne responsable m a indique ne pas pouvoir m ecouter sans autorisation de ma conseillere     et ma conseillere ne repond pas a mes mails   et j ai besoin  de travailler  merci;1;['succ', 'actuel', 'agenc', 'personnel', 'agent', 'prom', 'solicitud', 'appel', 'status', 'rqth', 'person', 'respons', 'caf', 'person', 'respons', 'autoris'];succ actuel agenc personnel agent prom solicitud appel status rqth person respons caf person respons autoris;-1
la nouvelle interface de declaration mensuelle pole emploi a une ergonomie completement ratee  anxiogene  qui prend plus de temps a remplir que precedemment sans apporter plus d information  et pousse a l erreur par de nombreux defauts   trop de pages  de boutons en cascade  de champs de saisie disperses et peu lisibles   et il faut meme faire des fausses declarations pour completer le formulaire  information confirmee par un conseiller pole emploi consulte par telephone    pour une micro entreprise sans activite ni chiffre d affaire  je dois declarer mensuellement 1h de travail et 1 euro de revenu  avec aucune de possibilite de joindre de fichier de declaration urssaf sur cette page  je dois aller le faire a part dans  mes echanges    autre gros defaut du site de pole emploi   pas d envoi systematique des courriers sur l adresse courriel personnelle de l usager  il faut se rendre sur leur site pour etre certain de ne rien rater  quelle serait notre vie s il fallait visiter tous nos comptes d administrations  de prestataires  d employeurs  de sante  de fournisseurs de services et d energies pour relever notre courrier chez eux   tous ces organismes envoient au minimum un avis dans la boite courriel personnelle de leur interlocuteur  pole emploi est le seul organisme a imposer de relever les courriers dans son interface web  c est injustifie ;1;['interfac', 'declar', 'ergonom', 'rate', 'anxiogen', 'apport', 'pouss', 'defaut', 'bouton', 'cascad', 'dispers', 'lisibl', 'declar', 'formulair', 'confirme', 'micro', 'affair', 'declar', '1h', 'declar', 'urssaf', 'defaut', 'courri', 'courriel', 'personnel', 'usag', 'rat', 'visit', 'compt', 'administr', 'prestatair', 'employeur', 'sant', 'fournisseur', 'servic', 'energ', 'courri', 'envoient', 'courriel', 'personnel', 'interlocuteur', 'impos', 'courri', 'interfac', 'web', 'injustif'];interfac declar ergonom rate anxiogen apport pouss defaut bouton cascad dispers lisibl declar formulair confirme micro affair declar 1h declar urssaf defaut courri courriel personnel usag rat visit compt administr prestatair employeur sant fournisseur servic energ courri envoient courriel personnel interlocuteur impos courri interfac web injustif;-1
ca fait 2 mois que je ne peux pas faire une declaration de situation sur le site internet de pole emploi  au telephone  quand j arrive a les joindre  ils m incitent a faire une fausse declaration   de declarer 1 heure de travail pour les lignes d employeurs qui bloquent la page  ou de declarer les heures travaillees sur un faux employeur qui bloque ma page aussi  j ai contacte un conseiller juridique et l urssaf   ils me deconseille de le faire car c est une raison de radiation   faire une fausse declaration  et pole emploi  ou leur logiciel  pourra me radier automatiquement puisque ca ne correspond pas aux declarations faites par mes employeurs enregistres pas l urssaf  alors apres pour revenir en tant que demandeur d emploi dans leur logiciel  ca va etre mission impossible   faire une demande de mediateur  passer devant un tribunal administratif  etc   ;1;['declar', 'internet', 'incitent', 'declar', 'declar', 'employeur', 'bloquent', 'declar', 'employeur', 'contact', 'jurid', 'urssaf', 'deconseil', 'declar', 'radi', 'declar', 'employeur', 'urssaf', 'reven', 'mediateur', 'tribunal', 'administr'];declar internet incitent declar declar employeur bloquent declar employeur contact jurid urssaf deconseil declar radi declar employeur urssaf reven mediateur tribunal administr;0
bonjour   je trouve qu il est tres complique de comprendre le montant de l allocation recu  ce n est pas juste que la methode de calcul est complexe en soi    il est pratiquement impossible de verifier et de comprendre le calcul car il n apparait jamais les chiffres sur la base desquels tout est defini   par exemple il est tres complique quand on a plusieurs employeurs de comprendre sur quel montant de salaire brut le calcul est fait   surtout quand il faut retirer les indemnites de fin de mission etc  cela rend vraiment l allocation opaque  il est tres complique de verifier s il n y a pas eu d erreurs  de comprendre    ne serait il pas possible de faire comme tous les employeurs en ont l obligation   une sorte de fiche de paye de l allocation avec tout le detail   ce serait normal et plus respectueux  cela eviterait que je fasse perdre du temps a mes conseillers pour qu ils m expliquent  j ai beau avoir compris la methode de calcul grace a leur aide  ce qui deja  n est a mon avis pas accessible a tout le monde   il est presque impossible de retrouver seul a partir des differentes fiches de paie  les montant bruts sur lesquels tout est calcule  et eux n ont pas le temps bien sur  pourtant si c est une obligation legale pour les employeurs de rendre le calcul de la paye transparent  cela ne devrait il pas etre de meme pour pole emploi  la caf  etc  j imagine que cela peut etre automatise  cela ameliorerait  beaucoup la confiance qu on peut avoir envers ces institutions si on recevait chaque mois   le detail clair et transparent de nos allocations   comme partout des erreurs peuvent arriver  et comme lorsque le boulanger nous rend la monnaie  nous devons pouvoir verifier  il faut donner a tous les citoyens et citoyennes les moyens pour cela   merci de votre attention  et merci pour votre travail au services de l amelioration du service public   c est une vraie chance que cela existe et ca doit etre salue  bon courage et bonne continuation ;1;['alloc', 'soi', 'pratiqu', 'appar', 'desquel', 'defin', 'employeur', 'salair', 'retir', 'indemnit', 'alloc', 'opaqu', 'employeur', 'pay', 'alloc', 'respectu', 'fass', 'expliquent', 'compr', 'accessibl', 'pai', 'brut', 'lesquel', 'legal', 'employeur', 'pay', 'transparent', 'caf', 'imagin', 'automatis', 'enver', 'institu', 'recev', 'transparent', 'alloc', 'partout', 'boulang', 'monnai', 'devon', 'citoyen', 'citoyen', 'servic', 'servic', 'vrai', 'salu', 'courag'];alloc soi pratiqu appar desquel defin employeur salair retir indemnit alloc opaqu employeur pay alloc respectu fass expliquent compr accessibl pai brut lesquel legal employeur pay transparent caf imagin automatis enver institu recev transparent alloc partout boulang monnai devon citoyen citoyen servic servic vrai salu courag;-1
l inscription s est parfaitement deroulee  ainsi que le 1er rendez vous en agence  le calcul de l allocation  lui  a ete un peu   complique avec changement de modes de calcul et formules  de salaires pris en compte   necessite de transmettre de nouveaux et nombreux documents pour aider a tomber sur le bon chiffre  toutes ces etapes se sont toujours parfaitement deroulees  soit a distance via internet  il faut juste savoir etre patient  pour la transmission des pieces notamment  et essayer d etre clair et concis dans ses mails pour etre compris accompagne et avoir les reponses a ses questions  soit sur place en agence  toujours dans un etat d esprit constructif  objectif  avec des agents  en l occurrence 2 collaboratrices  une a l accueil et une qui a gere mon dossier  toujours agreables  disponibles  a l ecoute  et ayant un vrai sens du conseil  elle a su prendre le temps de m expliquer  et ce a 3 reprises  en sortant de son bureau et venant a moi alors que je n avais pas rendez vous  sa collegue de l accueil lui ayant juste indique que j etais  dans les murs   et de la qualite du contact  un contact  humain   si important dans un contexte pareil  la perte d un emploi occupe depuis 12 ans et l inscription au pole emploi en vue d en retrouver un  a 56 ans  n est pas chose aisee  materiellement et humainement surtout  c est suffisamment rare a notre epoque pour meriter d etre signale  et comme il est coutumier et tres  francais  de comparer  et critiquer souvent  le  public  vs le  prive   je peux conclure que cette experience  service public  n avait rien a envier a bon nombres d experiences dans le  prive   ou la qualite du contact et la disponibilite competence des interlocuteurs ont malheureusement tendance a se degrader  meme si  bien evidemment  il faut se garder de generaliser  mais la tendance  a la baisse  est bien la malgre tout  donc bravo a l equipe et a la personne qui a gere mon dossier sur l antenne pole emploi de mon domicile;1;['deroule', 'agenc', 'alloc', 'mod', 'salair', 'compt', 'necessit', 'docu', 'tomb', 'etap', 'deroule', 'distanc', 'internet', 'patient', 'conc', 'compr', 'repons', 'agenc', 'esprit', 'construct', 'object', 'agent', 'occurrent', 'collabor', 'dossi', 'disponibl', 'bureau', 'collegu', 'mur', 'contact', 'contact', 'context', 'pareil', 'occup', '56', 'aise', 'materiel', 'rar', 'epoqu', 'merit', 'coutumi', 'compar', 'critiqu', 'v', 'conclur', 'servic', 'nombr', 'contact', 'disponibilit', 'competent', 'interlocuteur', 'tendanc', 'degrad', 'gard', 'generalis', 'tendanc', 'baiss', 'equip', 'person', 'dossi', 'anten'];deroule agenc alloc mod salair compt necessit docu tomb etap deroule distanc internet patient conc compr repons agenc esprit construct object agent occurrent collabor dossi disponibl bureau collegu mur contact contact context pareil occup 56 aise materiel rar epoqu merit coutumi compar critiqu v conclur servic nombr contact disponibilit competent interlocuteur tendanc degrad gard generalis tendanc baiss equip person dossi anten;-1
apres plusieurs appels aupres du 3949  on me dit systematiquement qu il est impossible de repondre a mes questions  je suis travailleur frontalier habitant en france sur le point de demissionner pour creer une entreprise     et que je dois m orienter vers un conseiller indemnisation  mais comme je ne suis pas inscrite a pole emploi  je ne peux pas avoir cette personne en ligne mais uniquement par mail   on me demande donc d aller sur le site et de trouver le lien  nous contacter   sauf que ce lien n oriente absolument pas vers une adresse mail mais vers d autres situations qui ne correspondent pas a la mienne ni a mes questions  je rappelle le 3949    desoles mais on ne peut rien pour vous  pourtant j avais des questions tres importantes pour ma situation   un grand merci a pole emploi pour son aide ;1;['appel', '3949', 'travailleur', 'frontali', 'habit', 'demission', 'orient', 'indemnis', 'inscrit', 'person', 'lien', 'contact', 'lien', 'orient', 'correspondent', 'mien', '3949', 'desol'];appel 3949 travailleur frontali habit demission orient indemnis inscrit person lien contact lien orient correspondent mien 3949 desol;-1
demarche pretendument simplifiee en realite plus compliquee et beaucoup plus intrusive  je suis autoentrepreneuse et auteure et je rencontre de nombreux problemes avec le nouveau formulaire     il ne prend pas en compte les revenus d auteur  et ses particularites  comme la declaration automatique par les editeurs a l urssaf limousin  un autre organisme que l urssaf  les cotisations sociales differentes des autoentrepreneurs et directement prelevees par les editeurs  soit non payees en differe      tout cela se fait evidemment au detriment des auteurs  qui risquent notamment d etre preleves deux fois des cotisations sociales    en tant qu autoentrepreneur  on peut parfois ne rien gagner certains mois  meme si on a travaille  prospection  compta  administratif      activites non remuneratrices   le nouveau formulaire refuse qu on mette qu on a travaille 0h dans le mois  mais si on met qu on a travaille un certain nombre d heures sans remuneration  en toute honnetete  cela arrive   comment est calcule le tarif horaire par pole emploi   en negatif   est ce ce type de revenus qui sera calcule pour nos retraites futures   et pourquoi nous demander le nombre de jours  en plus des heures travaillees   en quoi cette information est utile a pole emploi   a quoi va t elle leur servir  et comment cela va t il etre utilise dans le calcul des indemnites et des retraites   je me pose des questions sur ce nouveau systeme  qui arrive curieusement en meme temps que la reforme des retraites  pourquoi on nous demande tant de choses qui n etaient pas demandees avant   pourquoi ce nouveau formulaire est presente comme une simplification alors qu il rend l actualisation beaucoup plus complexe   pourquoi ce nouveau formulaire n a pas ete accompagne d explications et de transparence   pourquoi certains cas particuliers sont tout simplement ignores   les conseillers contactes n ont pas su m eclairer ni m aider a remplir le formulaire  je soupconne qu ils soient aussi perdus que moi   ;1;['demarch', 'pretendu', 'simplifie', 'complique', 'intrus', 'autoentrepren', 'auteur', 'formulair', 'compt', 'revenus', 'auteur', 'particularit', 'declar', 'editeur', 'urssaf', 'limousin', 'urssaf', 'autoentrepreneur', 'preleve', 'editeur', 'paye', 'differ', 'detr', 'auteur', 'risquent', 'prelev', 'autoentrepreneur', 'prospect', 'compt', 'administr', 'remuner', 'formulair', '0h', 'remuner', 'honnetet', 'tarif', 'horair', 'revenus', 'retrait', 'futur', 'util', 'serv', 'indemnit', 'retrait', 'system', 'curieux', 'reform', 'retrait', 'demande', 'formulair', 'formulair', 'transparent', 'ignor', 'contact', 'eclair', 'formulair', 'soupcon', 'perdus'];demarch pretendu simplifie complique intrus autoentrepren auteur formulair compt revenus auteur particularit declar editeur urssaf limousin urssaf autoentrepreneur preleve editeur paye differ detr auteur risquent prelev autoentrepreneur prospect compt administr remuner formulair 0h remuner honnetet tarif horair revenus retrait futur util serv indemnit retrait system curieux reform retrait demande formulair formulair transparent ignor contact eclair formulair soupcon perdus;-1
