Description;e-mail;Description_2;Description_3;clusters
suite a la fin d un cdd  j ai eu une periode de chomage tres courte durant laquelle je n ai jamais pu percevoir d indemnites malgre mes nombreuses relances  sur le site de pole emploi  certains documents etaient declares comme illisibles alors que toutes les informations necessaires etaient parfaitement lisibles pour commencer  les documents ont d abord ete mis sur la plateforme dans les bonnes categories  mais il n y avait pas la possibilite de les mettre a jour quand on m a dit qu ils etaient illisibles  j ai donc mis de nouvelles copies des documents dans des categories qui ne leur correspondaient pas  j ai bien evidemment recu un message comme quoi je m etais trompe de categorie et que mes documents etaient refuses  ces categories ont ensuite ete bloquees et impossible de proceder a de nouveaux envois  j ai donc decide d envoyer mes documents par email  mais ils etaient trop lourds pour les adresses mails des employes  j ai donc utilise wetransfer et par mesure de precaution j ai envoye les copies des documents par la poste au pole emploi des hauts de seine  a rueil malmaison   quelques jours plus tard j ai ete radie pour ne pas avoir envoye mes documents  je me suis reinscrit et j ai recommence toute la procedure sans avoir eu gain de causes  j ai bien entendu precise ma situation a chaque fois par email ;1;['cdd', 'chomag', 'court', 'percevoir', 'indemnit', 'nombreux', 'docu', 'declar', 'illisibl', 'lisibl', 'docu', 'abord', 'plateform', 'categor', 'illisibl', 'docu', 'categor', 'tromp', 'categor', 'docu', 'categor', 'bloque', 'proced', 'envois', 'docu', 'lourd', 'wetransf', 'precaut', 'docu', 'haut', 'sein', 'rueil', 'malmaison', 'docu', 'reinscr', 'recomment', 'procedur', 'gain', 'caus', 'entendu'];cdd chomag court percevoir indemnit nombreux docu declar illisibl lisibl docu abord plateform categor illisibl docu categor tromp categor docu categor bloque proced envois docu lourd wetransf precaut docu haut sein rueil malmaison docu reinscr recomment procedur gain caus entendu;2
j ai un projet de creation d entreprise pour la rentree de septembre  j ai envoye un mail a ma conseillere le 10 06  a ce jour je suis toujours sans reponse  j ai pourtant besoin d eclaircissements avant de pouvoir reellement avancer dans mes demarches;1;['rentre', '06', 'repons', 'eclairc', 'demarch'];rentre 06 repons eclairc demarch;-1
les courriels emis par les services de pole emploi ne sont pas proprement chiffres et signes  ce qui represente un reel souci de securite et de vie privee ;1;['courriel', 'emis', 'servic', 'propr', 'represent', 'souc', 'securit', 'prive'];courriel emis servic propr represent souc securit prive;-1
je remarque que les conseillers polemploi dans ma commune ne connaissent strictement rien a la creation d entreprise  ils melangent les textes de lois de la micro entreprise des autres statuts  au resultat  ils ne vous payent pas vos indemnites a temps  ce qui fait des trous dans ma tresorerie  a chaque fois  il faut se battre pour etre payer correctement  non seulement  la micro entreprise me prend du temps mais en plus polemploi me met des battons dans les roues   ;1;['remarqu', 'polemploi', 'connaissent', 'strict', 'melangent', 'lois', 'micro', 'payent', 'indemnit', 'trous', 'tresorer', 'battr', 'pai', 'micro', 'polemploi', 'batton', 'rou'];remarqu polemploi connaissent strict melangent lois micro payent indemnit trous tresorer battr pai micro polemploi batton rou;2
rien ne fonctionne  complexe conseillers qui vendent leur produit pour prouver qu ils servent a qlq chosegros budget pour peu de resultatsquand le gouvernement va reagir et fermer ces etablissements qui coutent tres cherje remercie les agences d interim ;1;['vendent', 'produit', 'prouv', 'qlq', 'chosegros', 'budget', 'resultatsquand', 'gouvern', 'reag', 'ferm', 'etabl', 'coutent', 'cherj', 'agenc', 'interim'];vendent produit prouv qlq chosegros budget resultatsquand gouvern reag ferm etabl coutent cherj agenc interim;-1
le 19 avril 2017  j ai ete licencie de mon poste d hotesse d accueil en entreprise sans preavis et sans procedureje me suis inscrite au pole emploi d asnieres sur seine le en avril 2017 de la ville d asnieres sur seinele pole emploi a refuse de finaliser la procedure dama qui permet la transmission de mon actualisation au pole emploi pour le versement de mes indemnites de chomage tout les mois  j ai ete oblige de reclamer a l accueil une attestation d actualisation que j envoyais moi meme par e mail au gestionnaire de la reunion des musees nationaux  les delais de versement de mes indemnites de chomage n etaient pas respectes  le pole emploi ne me remettait pas d attestation de versement de mon chomage  j ai ete accueilli a chaque fois comme une personne etrangere et en situation d irregularites  j ai ete denigre suite a mon demenagement vers la ville de capesterre belle eau  le pole emploi m a informe que la transmission de mon dossier vers la guadeloupe prendrait plus d une annee le pole emploi de capesterre belle eau a dit que j etais inscrite au pole emploi depuis le 13 fevrier 2018  je me suis toujours actualise dans les delais  le pole emploi a modifie a plusieurs reprises ma date d inscription au pole emploi le pole emploi de capesterre belle eau a refuse de l accorder l aide a l obtention du permis de conduire  le pole emploi a refuse de me remettre l entierete de mes indemnites de chomage salarie le pole emploi a refuse de me remettre mes indemnites d artiste auteur pour mon activite de creatrice textileplusieurs demandes de formation m ont ete refuse ;1;['19', '2017', 'licenc', 'hotess', 'preav', 'procedurej', 'inscrit', 'asnier', 'sein', '2017', 'asnier', 'seinel', 'procedur', 'indemnit', 'chomag', 'reclam', 'attest', 'e', 'gestionnair', 'muse', 'national', 'indemnit', 'chomag', 'respect', 'remet', 'attest', 'chomag', 'person', 'etranger', 'irregularit', 'denigr', 'demenag', 'capesterr', 'eau', 'dossi', 'guadeloup', 'prendr', 'capesterr', 'eau', 'inscrit', '13', '2018', 'capesterr', 'eau', 'accord', 'obtent', 'conduir', 'remettr', 'entieret', 'indemnit', 'chomag', 'remettr', 'indemnit', 'artist', 'auteur', 'creatric', 'textileplusieur', 'format'];19 2017 licenc hotess preav procedurej inscrit asnier sein 2017 asnier seinel procedur indemnit chomag reclam attest e gestionnair muse national indemnit chomag respect remet attest chomag person etranger irregularit denigr demenag capesterr eau dossi guadeloup prendr capesterr eau inscrit 13 2018 capesterr eau accord obtent conduir remettr entieret indemnit chomag remettr indemnit artist auteur creatric textileplusieur format;2
malgre les mails envoyes  2 semaines avant  pour demander un document indispensable pour une inscription a un concours  reorientation professionnelle  en precisant la date buttoir pour un des etablissements en vue  impossible d obtenir un rendez vous meme telephonique avant la dite date  resultat  la conseillere au telephone explique qu elle va envoyer le document des la fin de l appel  11h30   document recu a 15h  impossible a ouvrir  la derniere levee etant a 16h  deux jours apres la conseillere envoie un mail    desolee  je suppose qu il est trop tard   idem pour une convention de stage  document transmis il y a 3 semaines  stages dans 2 semaines  toujours aucun retour ;1;['docu', 'indispens', 'concour', 'reorient', 'buttoir', 'etabl', 'docu', 'appel', '11h30', 'docu', '15h', 'leve', '16h', 'desole', 'suppos', 'idem', 'convent', 'docu'];docu indispens concour reorient buttoir etabl docu appel 11h30 docu 15h leve 16h desole suppos idem convent docu;2
je demande ma mise a la retraite  impossible d avoir un conseiller  pole emploi me demande un formulaire de regularisation de retraite impossible de l obtenir  a partir de mars  pole emploi ne me versera plus mes aides  ;1;['retrait', 'formulair', 'retrait'];retrait formulair retrait;-1
je suis un senior de 58 ans qui a souhaite devenir autoentrepreneur apres son licenciement fin mars  j ai sollicite a plusieurs reprises mon conseiller pole emploi pour m aider dans mes demarches   pas le temps de me recevoir  j ai commis une erreur en construisant mon dossier qui aurait pu etre eviter si j avais beneficie de l aide demandee  j ai trouve une mission suite a 4 entretiens avec une societe de prestations dans le cadre de ma nouvelle entreprise  celle ci  debutera debut mai prochain  il est important d etre soutenu dans la premiere periode de chomage car cela determine son investissement personnel et sa politique de recherche d emploi  l humain est important pour affronter l epreuve du chomage  internet ne suffit pas     ;1;['senior', '58', 'deven', 'autoentrepreneur', 'licenci', 'demarch', 'comm', 'construis', 'dossi', 'benefic', 'demande', 'debut', 'soutenu', 'chomag', 'determin', 'invest', 'personnel', 'polit', 'affront', 'epreuv', 'chomag', 'internet', 'suff'];senior 58 deven autoentrepreneur licenci demarch comm construis dossi benefic demande debut soutenu chomag determin invest personnel polit affront epreuv chomag internet suff;-1
j ai suivi le programme d accompagnement intensif jeune de pole emploi  ma conseillere a ete tres a l ecoute  ce programme m a ete d une grande aide puisque j ai pu passer une formation essentielle pour la suite de mon projet professionnel ;1;['programm', 'intens', 'jeun', 'programm', 'format', 'essentiel'];programm intens jeun programm format essentiel;1
service concerne  pole emploi de lunelapres avoir exerce le meme metier pendant 16 ans  je ne souhaitais plus l exercer et voulais donc entamer une reconversion professionnelle  mais cela representait un gros changement et beaucoup d apprehensions  ma conseillere du pole emploi de lunel a ete a mon ecoute et m a aide a construire ce nouveau projet  pour cela  j ai pu echanger avec un psychologue du travail  et j ai ensuite beneficie de la prestation activ  projet  celle ci m a permis de definir clairement un nouveau projet et de mettre en place les actions necessaires pour me reconvertir  j ai pu entamer une formation pour commencer a me former a mon nouveau metier  aujourd hui je suis en contrat de professionnalisation afin de pouvoir obtenir un diplome dans ce nouveau metier ma conseillere a ete disponible et a repondu a mes questions tout au long de ce parcours et son aide a ete precieuse  elle a su me proposer les bons outils pour entamer cette reconversion  sans cela je n aurais sans doute pas ose  sauter le pas  ;1;['servic', 'lunelapr', 'exerc', '16', 'exerc', 'entam', 'reconvers', 'represent', 'apprehens', 'lunel', 'construir', 'psychologu', 'benefic', 'defin', 'reconvert', 'entam', 'format', 'contrat', 'professionnalis', 'precieux', 'entam', 'reconvers', 'ose', 'saut'];servic lunelapr exerc 16 exerc entam reconvers represent apprehens lunel construir psychologu benefic defin reconvert entam format contrat professionnalis precieux entam reconvers ose saut;-1
tres bonne experience  une conseillere a l ecoute et tres reactive a toutes mes interrogations et besoins  ;1;['reactiv', 'interrog', 'besoin'];reactiv interrog besoin;-1
suite a une demande invalidite pour la cpam  je ne peux plus recuperer mes anciennes attestions  mensuelles et globales  pole emploi  il m a ete repondu que sur mon espace personnel p e   on pouvait recuperer 6 mois par 6 mois  cela n est pas exact  je suggere un  e coffre  heberge soit par la carsat  des le debut de carriere   soit par la cpam  puisqu on a un numero de secu des le 1er emploi   ou toute autre e administration qui semblerait judicieuse a cause de cela  je ne vais pas pouvoir finaliser ma demande invalidite  je suis a 100  exonerante   ni beneficier de mes justificatifs pour ma retraite ;1;['invalidit', 'cpam', 'recuper', 'attest', 'global', 'personnel', 'p', 'e', 'recuper', 'exact', 'sugger', 'e', 'coffr', 'heberg', 'carsat', 'cpam', 'puisqu', 'secu', 'e', 'administr', 'sembl', 'judici', 'invalidit', '100', 'exoner', 'justif', 'retrait'];invalidit cpam recuper attest global personnel p e recuper exact sugger e coffr heberg carsat cpam puisqu secu e administr sembl judici invalidit 100 exoner justif retrait;-1
efficacite de la conseillerereponse claire du service indemniteles applications pole emploi sont tres performantes ;1;['efficacit', 'conseillererepons', 'servic', 'indemnitel', 'perform'];efficacit conseillererepons servic indemnitel perform;-1
a ce jour je n ai toujours pas recu la prime de noel de la part de pole emploi alors que je suis eligible  en effet je touche l ass  pole emploi quand on arrive a les contacter demande a chaque fois un nouveau justificatif alors que cette prime est sensee etre versee automatiquement    il demande un justificatif de la caf  celle ci reponds que ce document n existe pas  c est un combat administratif inconcevable et perdu d avance tellement personne ne repond la meme chose  or j ai enormement besoin de cette prime en ce moment tout simplement pour pouvoir survivre   il n y a rien de positif dans mon histoire  je suis a bout ;1;['noel', 'eligibl', 'ass', 'contact', 'justif', 'sense', 'verse', 'justif', 'caf', 'docu', 'combat', 'administr', 'inconcev', 'person', 'survivr', 'histoir'];noel eligibl ass contact justif sense verse justif caf docu combat administr inconcev person survivr histoir;2
impossibilite de recuperer des attestations de plus de 3 anpas d espace messagerie pour communiquer  hors mis les reclamations et une question concernant offre d emploi avec son conseiller effacement des dossiers d inscription de plus de 3 ans;1;['impossibilit', 'recuper', 'attest', 'anpas', 'messager', 'communiqu', 'hor', 'reclam', 'offre', 'effac', 'dossi'];impossibilit recuper attest anpas messager communiqu hor reclam offre effac dossi;-1
j ai plusieurs experiences et il serait trop long de les detailler toutes icicontexte le principal probleme que j identifie vient du fonctionnement de la messagerie lorsqu on ecrit a un conseiller pole emploi 1  l historique de conversation disparait  quand on recoit la reponse du conseiller  on ne sait pas a quelle question il repond  et lui n a pas le temps d ecrire de longs textes s il s agit de questions tres precises2  l objet de l email  que je m applique a soigner  disparait dans la reponse  donc meme probleme  cf  exemple ci apres3  une autre personne  que le conseiller  peut y repondre et ne rien comprendre a l echangedu cote de pole emploi c est peut etre  lisible  afin de comprendre la demande du chomeur dans un echange de  questions reponses   mais du cote usager  c est ubuesque pour couronner le tout  on recoit un accuse de reception de l email envoye a notre conseiller  mais on ne sait pas quel email vecudans le cas d un echange urgent sur une signature de contrat entre pole emploi  une entreprise et moi  nous sommes retrouves dans cette situationexemple d objet d email de reponse de mon conseiller  ai remplace certains chiffres par un  x   pole emploi  200xxx000000xxx72 reponse de votre pole emploresultat  perte de temps cote pole emploi  usager et entreprise ;1;['detaill', 'icicontext', 'identif', 'vient', 'messager', 'lorsqu', 'histor', 'dispar', 'recoit', 'repons', 'ecrir', 'long', 'agit', 'precises2', 'objet', 'soign', 'dispar', 'repons', 'cf', 'apres3', 'person', 'echangedu', 'lisibl', 'repons', 'usag', 'ubuesqu', 'couron', 'recoit', 'accus', 'vecudan', 'urgent', 'signatur', 'contrat', 'retrouv', 'situationexempl', 'objet', 'repons', 'remplac', 'x', '200xxx000000xxx72', 'repons', 'emploresultat', 'usag'];detaill icicontext identif vient messager lorsqu histor dispar recoit repons ecrir long agit precises2 objet soign dispar repons cf apres3 person echangedu lisibl repons usag ubuesqu couron recoit accus vecudan urgent signatur contrat retrouv situationexempl objet repons remplac x 200xxx000000xxx72 repons emploresultat usag;-1
inscrite a pole emploi depuis un an  je n ai rencontre mon conseiller qu une fois j ai du le joindre deux fois par mail pour des renseignements et a la fin de mes deux conversations telephoniques  mon conseiller me dit    je vais vous envoyer une synthese de l entretien  mais de quel entretien parle t il   si je ne l avais pas contacte  jamais il n aurait pu remplir ses statistiques  je me demene pour trouver une formation je lui envoie un mail pour l en informer  il me rappelle et me dit  bon a quelle session souhaitez vous vous inscrire     je lui reponds  c est bon je suis en contact directement avec l organisme de formation  je verrais avec eux pour l inscription a la session   il me repond que l objectif c est qu il me place  j effectue toutes mes demarches seules et c est le conseiller qui va en retirer les lauriers en disant a son administration qu il m a place si je reprends ses termes  c est honteuxa part  vanter le site internet pole emploi  les conseillers n apportent rien en terme de conseils  de recherche sur notre secteur d activite  etc  la preuve apres un an de recherche  je suis toujours a la recherche d un emploi avec un seul rendez vous  je me pose vraiment la question de savoir si tous les conseillers pole emploi conseillent les demandeurs d emploi de la meme facon ;1;['inscrit', 'synthes', 'contact', 'statist', 'demen', 'format', 'session', 'contact', 'format', 'verr', 'session', 'object', 'demarch', 'seul', 'retir', 'lauri', 'administr', 'reprend', 'vant', 'internet', 'apportent', 'conseillent'];inscrit synthes contact statist demen format session contact format verr session object demarch seul retir lauri administr reprend vant internet apportent conseillent;-1
j ai recu un courriel a mon adresse email concernant le depot d un courrier pole emploi a mon espace de demandeur d emploi le fichier est corrompu  il n est pas possible de lire le fichier  j ai change de telephone portable  j ai aussi change le moteur de recherche mais les courriers deposes a mon espace de demandeur d emploi sont rendus illisiblesce n est pas la premiere fois que la qualite de mon service de pole emploi est deteriore  je souhaite le signaler c est une atteinte a l article 226 15 du code penal qui concerne les correspondances ;1;['courriel', 'depot', 'courri', 'corrompu', 'portabl', 'moteur', 'courri', 'rendus', 'illisiblesc', 'servic', 'deterior', 'atteint', 'articl', '226', 'penal'];courriel depot courri corrompu portabl moteur courri rendus illisiblesc servic deterior atteint articl 226 penal;-1
suite a une demission en juillet 2019  j ai voulu trouver le moyen d ouvrir mes droits au chomage pour pouvoir faire une formation pole emploi m a guidee tout du long de mon parcours tout d abord en me proposant d effectuer un travail saisonnier ce qui me permettait d ouvrir mes droits au chomage  suite a cette emploi qui a dure 8 mois  de aout 2019 a mars 2020   j ai donc pu obtenir les aides au retour a l emploi et realiser mon projet de reconversion professionnelle pole emploi m a guidee dans mon choix de centre de formation  puis dans les aides de financement  grace a un rendez vous avec un psychologue sur place  j ai pu confirmer mon choix de me former en tant qu assistante comptable  les demarches entre pole emploi et le centre de formation on ete tres complique car il y a peu de communication entre les deux  mais avec acharnement  j ai pu debuter ma formation en septembre 2020 et etre finalement embauche dans un cabinet comptable en tant que secretaire comptable ma conseillere pole emploi a ete tres presente toute au long de mon parcours et tres reactive  j ai eu beaucoup de chance de l avoir et elle m a permis d avancer rapidement et efficacement sur mon projet meme si ca a prit du temps  mais au bout d un parcours de reconversion qui a prit 1 an et demi  j ai enfin pu atteindre mon objectif  ;1;['demiss', 'juillet', '2019', 'chomag', 'format', 'guide', 'abord', 'saisonni', 'chomag', '2019', 'reconvers', 'guide', 'format', 'financ', 'psychologu', 'confirm', 'comptabl', 'demarch', 'format', 'acharn', 'debut', 'format', 'cabinet', 'comptabl', 'secretair', 'comptabl', 'reactiv', 'efficac', 'prit', 'reconvers', 'prit', 'dem', 'atteindr', 'object'];demiss juillet 2019 chomag format guide abord saisonni chomag 2019 reconvers guide format financ psychologu confirm comptabl demarch format acharn debut format cabinet comptabl secretair comptabl reactiv efficac prit reconvers prit dem atteindr object;1
depuis le mois de mars 2021 nous n avons toujours pas recu notre aide legale due au titre du chomage partiel il nous a ete repondu que l administration etait debordee  depuis  malgre tous les documents transmis  nous n avons recu aucune reponse a nos mails et nos messages telephoniques merci de prendre le relai cela devient insoutenable et cela met en peril notre entreprise bien cordialement ;1;['legal', 'du', 'chomag', 'administr', 'deborde', 'docu', 'repons', 'rel', 'insouten', 'peril'];legal du chomag administr deborde docu repons rel insouten peril;2
j avais demande par courrier en lr avec ar en date de mi avril 2021 un rendez vous avec un conseiller pole emploi ou le directeur afin d avoir des explications fiables  exactes  sures et non approximatives sur le montant alloue en allocation de chomage pour la periode du 01 04 a mi mai 2021 puisque des mi mai j ai retrouve moi meme un emploi durant ce temps pas un appel d un conseiller  ni meme d une eventuelle proposition de formation ou encore pour connaitre le pourquoi du comment de la perte d emploi durant ce mois et 9 jours de chomage  j ai appele le 3949 pratiquement tous les jours et a chaque fois les explications et les informations etaient differentes de la veilles   c est quand meme fou   bravo a l algorithme utilise par pole emploi  voir article de france inter du 02 11 2019 de lea guedj    n arrivant pas a avoir de bons conseils et explications  je me suis rendu par 2 fois directement au pole emploi cristallerie  tous cela pour rien  le conseiller m a endormi avec des explications a dormir debout et qui en plus m a pris de haut   conclusions du probleme    nous sommes le 27 07 et toujours aucune nouvelle du pole emploi pour ces fameuses explications   j ai fait plusieurs relance pour enfin avoir de vraies explications sur le versement bizarrement calcule de mon allocation de chomage  j ai meme transmis mes courriers et mes demandes a mme la deputee de nancy pour qu elle puisse intervenir  il m a ete repondu d une maniere laconique et  bateau  qu elle comprenait la situation et que j allais etre contacte prochainement    nous sommes quand meme le 27 07  4 mois  et toujours rien    bravo ;1;['courri', 'lr', 'ar', 'mi', 'directeur', 'fiabl', 'exact', 'sur', 'approxim', 'allou', 'alloc', 'chomag', '01', '04', 'mi', 'mi', 'appel', 'eventuel', 'format', 'connaitr', '9', 'chomag', 'appel', '3949', 'pratiqu', 'veil', 'fou', 'algorithm', 'articl', 'inter', '02', '11', '2019', 'le', 'guedj', 'arriv', 'cristaller', 'endorm', 'dorm', 'debout', 'haut', 'conclus', '27', '07', 'fameux', 'vrai', 'bizarr', 'alloc', 'chomag', 'courri', 'mme', 'depute', 'nancy', 'interven', 'lacon', 'bateau', 'compren', 'allais', 'contact', '27', '07'];courri lr ar mi directeur fiabl exact sur approxim allou alloc chomag 01 04 mi mi appel eventuel format connaitr 9 chomag appel 3949 pratiqu veil fou algorithm articl inter 02 11 2019 le guedj arriv cristaller endorm dorm debout haut conclus 27 07 fameux vrai bizarr alloc chomag courri mme depute nancy interven lacon bateau compren allais contact 27 07;-1
pour eviter les papiers  quand est ce que pole emploi et ameli vont s accorder pour le cesu   au vu de mes multiples employeurs  cela peut aller entre 300 et 500 feuilles et des fois plus  on renonce a nos droits  par contre lors de controle des services trouvent la solution  j ai meme un courrier c est bizarre    cordialement ;1;['amel', 'accord', 'employeur', '300', '500', 'renonc', 'servic', 'trouvent', 'courri', 'bizarr'];amel accord employeur 300 500 renonc servic trouvent courri bizarr;0
